closest counterfactual,closest true text,embedding distance,polyjuice similarity spacy,target text
alternately frustrating and sad .,despite story predictable sound music play like nail bite thriller heart right place difficult peeved,0.551708996295929,0.7891548537287325,alternately frustrating and rewarding .
"the fact is that the screen is so far out of focus when it seems most likely that broomfield's interviewees , or even himself , will not be for much longer .",badly level actually have hard time believe people pay,0.4080968201160431,0.9014033381284247,"the fact is that the screen is most alive when it seems most likely that broomfield's interviewees , or even himself , will not be for much longer ."
"Technicolor photography, excellent dubbing, and bad sets are what make this a bad film, no matter how you look the Technicolor photography for the tuxedo.",film sound like stuff lurid melodrama make interesting character study fact story tell paul perspective,0.4913545250892639,0.8697729268562826,"the techno tux is good for a few laughs , as are chan and hewitt , but when such a good design turns out to be a cheap knockoff , we can't recommend anything but a rental for the tuxedo ."
"a work of intricate elegance , literary lyricism and profound regional sense .",stunning lyrical work considerable force truth,0.577782154083252,0.8619125048194769,"a work of intricate elegance , literary lyricism and profound common sense ."
it will take 19 months to do this.,feel like work finally age past prime realize want like people work,0.29522135853767395,0.8601819607851371,it took 19 predecessors to get this ?
it was here's the biker gang that killed his wife that would have made vittorio de sica very proud.,yes suppose lovely cal work issue dad come term picture perfect life world traveler give reason care,0.2718065083026886,0.8441144771395837,now here's a sadistic bike flick that would have made vittorio de sica proud .
"steven soderbergh has failed, and the will of god has been denied.",reign fire look thought well watch way,0.3905197083950043,0.7718652373517196,if steven soderbergh's 'solaris' is a failure it is a glorious failure .
what's really so appealing about the characters is their resemblance to everyday people children .,old people love movie mean nice possible way order touch heart old earn 50 year friendship,0.7364175319671631,0.8965373184722972,what's really so appealing about the characters is their resemblance to everyday children .
"the story may not be new , but australian director johnny polson , making his american feature debut , jazzes it up adroitly .",visit spy movie territory like novel examine footnote history seldom bring light screen keep guess frame,0.5148545503616333,0.8537145015587538,"the story may not be new , but australian director john polson , making his american feature debut , jazzes it up adroitly ."
"light , silly , photographed with colour and depth , and rather dull a good time .",light silly photograph colour depth good time,0.7715561389923096,0.8861828514723004,"light , silly , photographed with colour and depth , and rather a good time ."
"EMPTY, it's clear that all about the benjamins is a totally plot movie.",say ice age fairly pretty picture substance story actually life,0.4354245364665985,0.8785360383362503,"from the opening scenes , it's clear that all about the benjamins is a totally formulaic movie ."
Yet this movie is just a depressing piece of atmospheric mechanisms built to hock it up.,good thing film mind look like creative process operate,0.5354137420654297,0.8679128353264725,"it is the sheer , selfish , wound-licking , bar-scrapping doggedness of leon's struggle to face and transmute his demons that makes the movie a spirited and touching occasion , despite its patchy construction ."
"as the story moves inexorably through its seven day timeframe , the image becomes increasingly mesmerizing .",parker commend take fresh approach familiar material determination remain true original text lead adopt somewhat mannered tone ultimately dull human tragedy story core,0.5319576859474182,0.8488230414717987,"as the story moves inexorably through its seven day timeframe , the picture becomes increasingly mesmerizing ."
