24,an old fashioned drama of substance about a teacher s slide down the slippery slope of dishonesty after an encounter with the rich and the powerful who have nothing but disdain for viue,1,an old fashioned drama of substance about a teacher s slide down the slippery slope of dishonesty after an encounter with the rich and the powerful who have nothing but disdain for viue,1,1,0.9836065573770492,"['the film has all the rules of lurid melodrama but ', 'the film has the heavy handed that takes up with a ', 'the film has a laundry cast of war guilt as it is ', 'the film has the heavy handed of a house ambition ', 'the film has a laundry exercise in camera work but ']","['the movie has been in years old but even with the ', 'the film has the perfect characters are not to give ', 'the movie has been readily dismissed as the pitch ', 'the movie has been readily dismissed as the website ']","{'heavy': 0.1111111111111111, 'handed': 0.1111111111111111, 'laundry': 0.1111111111111111, 'rules': 0.05555555555555555, 'lurid': 0.05555555555555555}","{'readily': 0.16666666666666666, 'dismissed': 0.16666666666666666, 'years': 0.08333333333333333, 'old': 0.08333333333333333, 'even': 0.08333333333333333}"
25,it wouldn t be my preferred way of spending 100 minutes or 7 00,0,it wouldn t be my preferred way of spending 100 minutes or 7 00,0,0,0.9615384615384616,"['a movie that rare into a man who can not always in ', 'the film is a primer on its own and fills its characters ', 'a movie that rare into a man who can t seen it s not ', 'the film is a primer on its own it feels like a lot ', 'the film is a primer on sentence of the film a movie ']","['the film is a primer on its own his director in its ', 'the film is a primer on its own in town with sensitivity ', 'the film is a primer on its own and fills one of america ', 'a movie that so lovingly and present the one of screen ', 'it s a very tasteful to look at the most were what ']","{'primer': 0.2, 'rare': 0.13333333333333333, 'man': 0.13333333333333333, 'always': 0.06666666666666667, 'fills': 0.06666666666666667}","{'primer': 0.2, 'one': 0.13333333333333333, 'director': 0.06666666666666667, 'town': 0.06666666666666667, 'sensitivity': 0.06666666666666667}"
26,flawed but wohy look at life in u s relocation camps,1,flawed but wohy look at life in u s relocation camps,1,1,1.0,"['it s a very tasteful rock and roll movie you could ', 'the film is a primer on its own in town with action ', 'a movie that so lovingly and present the most of screen ', 'the film is a primer on its own and director michael ', 'the film is a primer on its own it s a of above the ']","['a movie that rare into a man who can not mount a buyer ', 'the film is so of the 70s or film in which it s performance ', 'the film is a primer on sentence of the film a movie ']","{'primer': 0.21428571428571427, 'tasteful': 0.07142857142857142, 'rock': 0.07142857142857142, 'roll': 0.07142857142857142, 'could': 0.07142857142857142}","{'rare': 0.125, 'man': 0.125, 'mount': 0.125, 'buyer': 0.125, '70s': 0.125}"
27,mckay seems embarrassed by his own invention and tries to rush through the intermediary passages apparently hoping that the audience will not notice the glaring triteness of the plot device he has put in service,0,mckay seems embarrassed by his own invention and tries to rush through the intermediary passages apparently hoping that the audience will not notice the glaring triteness of the plot device he has put in service,0,0,1.0,"['the movie has been in this time or staling melodrama ', 'the movie has been a huge that s movie it would have ', 'the movie has been readily dismissed as the film does ', 'the movie has been in years old but even with the ', 'the movie has been more than a fair film but director ']","['the film has the number of s a similarly morose and ', 'the film has a laundry cast of war shocomings are ', 'the film has all the rules of lurid melodrama but ', 'the film has the perfect characters are not an intelligent ', 'the film has an infectious enthusiasm and the movie ']","{'time': 0.08333333333333333, 'staling': 0.08333333333333333, 'melodrama': 0.08333333333333333, 'huge': 0.08333333333333333, 'would': 0.08333333333333333}","{'number': 0.06666666666666667, 'similarly': 0.06666666666666667, 'morose': 0.06666666666666667, 'laundry': 0.06666666666666667, 'cast': 0.06666666666666667}"
28,director andrew niccol demonstrates a wry understanding of the quirks of fame his healthy sense of satire is light and fun,1,director andrew niccol demonstrates a wry understanding of the quirks of fame his healthy sense of satire is light and fun,1,1,1.0,"['the film is a primer on the rules of attraction and ', 'the film has a laundry exercise in camera and that ', 'the film is a primer on the beach with humor and american ', 'the film is so of those who try to look at but it ', 'the film has a contrivance as aificial as the film ']","['the film is a primer on its own hollywood director ', 'the film is a primer on its own animated tv and rather ', 'the film is too many or even through the movie s hero ', 'the film is too many or sugary through to think that ']","{'primer': 0.14285714285714285, 'rules': 0.07142857142857142, 'attraction': 0.07142857142857142, 'laundry': 0.07142857142857142, 'exercise': 0.07142857142857142}","{'primer': 0.15384615384615385, 'many': 0.15384615384615385, 'hollywood': 0.07692307692307693, 'director': 0.07692307692307693, 'animated': 0.07692307692307693}"
29,as pure over the top trash any john waters movie has it beat by a country mile,0,as pure over the top trash any john waters movie has it beat by a country mile,0,1,0.9512195121951219,"['the film is a primer on its own and director michael ', 'the film is a primer on the rules of attraction and ', 'it s a very tasteful to look at the most were what ', 'the film has a number of themes a complex on that ', 'the film is a primer on its own director director ']","['a movie that one would be profane politically the ', 'the film is a primer on its own animated tv in which ']","{'primer': 0.21428571428571427, 'director': 0.21428571428571427, 'michael': 0.07142857142857142, 'rules': 0.07142857142857142, 'attraction': 0.07142857142857142}","{'one': 0.14285714285714285, 'would': 0.14285714285714285, 'profane': 0.14285714285714285, 'politically': 0.14285714285714285, 'primer': 0.14285714285714285}"
30,rymer doesn t trust laughs and doesn t conjure proper respect for followers of the whole dead undead genre who deserve more from a vampire pic than a few shrieky special effects,0,rymer doesn t trust laughs and doesn t conjure proper respect for followers of the whole dead undead genre who deserve more from a vampire pic than a few shrieky special effects,0,0,1.0,"['the film has the perfect characters are not to lend ', 'the movie has been readily dismissed as the pitch ', 'the film has the perfect characters are not to compromise ', 'the movie has been in this is that time is a rewarding ', 'the film has the perfect characters are not to give ']","['the film has a laundry cast of human situation and ', 'the film has the perfect of s best and the film s ', 'the film has a laundry cast of human comedy that it ', 'the film has a laundry list of camera work in which ', 'the film has the perfect characters are not much of ']","{'perfect': 0.21428571428571427, 'characters': 0.21428571428571427, 'lend': 0.07142857142857142, 'readily': 0.07142857142857142, 'dismissed': 0.07142857142857142}","{'laundry': 0.17647058823529413, 'cast': 0.11764705882352941, 'human': 0.11764705882352941, 'perfect': 0.11764705882352941, 'situation': 0.058823529411764705}"
31,when de palma s bad he s really bad and femme fatale ranks with the worst he has done,0,when de palma s bad he s really bad and femme fatale ranks with the worst he has done,0,0,0.9347826086956522,"['the film is so many of its own in reality tv in which ', 'the film is so many of the time it s so bad that it ', 'the film is a primer on its own animated tv director ', 'the film is too many or even video it s got a movie ', 'the film is so heavy handed that doesn t get an interest ']","['the film is a primer on its own director director ', 'the film is so of the 70s it would be adequately emphasized ', 'the film is a primer on its own and director michael ', 'the film is so many of its own in reality filmmaking ', 'the film is a primer on its own school comedy with ']","{'many': 0.16666666666666666, 'tv': 0.1111111111111111, 'reality': 0.05555555555555555, 'time': 0.05555555555555555, 'bad': 0.05555555555555555}","{'primer': 0.1875, 'director': 0.1875, '70s': 0.0625, 'would': 0.0625, 'adequately': 0.0625}"
32,has its moments and almost as many subplots,0,has its moments and almost as many subplots,1,1,1.0,"['a thoughtful movie that he s endless of delights and ', 'a movie that rare into the reunion of and the 15 a ', 'a movie that rare into the reunion of s a performance ', 'the film is a primer on sentence of the film a caoon ', 'the film s so uninspiring that could a taste of the ']","['a movie that rare into a man who can not always in ', 'the film s so predictable and are rolling over the ', 'a movie that one would have been seen in advance or ', 'a movie that so fresh and thoroughly but el is bad ']","{'rare': 0.13333333333333333, 'reunion': 0.13333333333333333, 'thoughtful': 0.06666666666666667, 'endless': 0.06666666666666667, 'delights': 0.06666666666666667}","{'rare': 0.07692307692307693, 'man': 0.07692307692307693, 'always': 0.07692307692307693, 'predictable': 0.07692307692307693, 'rolling': 0.07692307692307693}"
33,sewer rats could watch this movie and be so skeeved out that they d need a shower,0,sewer rats could watch this movie and be so skeeved out that they d need a shower,0,0,0.9743589743589743,"['the film is a primer on its own it feels like a lot ', 'the film is a primer on its own and fills its characters ', 'the film is a primer on sentence of the film a movie ', 'the film is so many that time through the film s mid ', 'the film is so of the 70s or film in which it s performance ']","['a movie that so of the highest and the most famous ', 'it s a very tasteful rock and roll movie you could ', 'the film is a primer on its own it fills a good movie ', 'the film is a primer on its own and director in years ', 'the film has a number of themes a complex on a good ']","{'primer': 0.21428571428571427, 'feels': 0.07142857142857142, 'like': 0.07142857142857142, 'lot': 0.07142857142857142, 'fills': 0.07142857142857142}","{'primer': 0.125, 'good': 0.125, 'highest': 0.0625, 'famous': 0.0625, 'tasteful': 0.0625}"
34,directed without the expected flair or imagination by hong kong master john woo windtalkers airs just about every cliche in the war movie compendium across its indulgent two hour and fifteen minute length,0,directed without the expected flair or imagination by hong kong master john woo windtalkers airs just about every cliche in the war movie compendium across its indulgent two hour and fifteen minute length,0,0,0.9811320754716981,"['the film has the perfect characters are not to give ', 'the film has been a huge that the movie it would have ', 'the film has been a huge fan of dickens in which is ', 'the film has all the rules of water melodrama which ', 'the film has a laundry exercise in which history or ']","['the film has a laundry list of camera work in which ', 'the film has an infectious enthusiasm and it s so ', 'the film has a laundry cast of human observation and ', 'the film has a laundry list of war shocomings but ', 'the film has a laundry cast of movie references but ']","{'huge': 0.14285714285714285, 'perfect': 0.07142857142857142, 'characters': 0.07142857142857142, 'give': 0.07142857142857142, 'would': 0.07142857142857142}","{'laundry': 0.23529411764705882, 'list': 0.11764705882352941, 'cast': 0.11764705882352941, 'camera': 0.058823529411764705, 'work': 0.058823529411764705}"
35,an alternately raucous and sappy ethnic sitcom you d be wise to send your regrets,0,an alternately raucous and sappy ethnic sitcom you d be wise to send your regrets,1,1,0.9811320754716981,"['the film is so many that his face in favor of his ', 'the film is a primer on its own it s a of healthy ', 'the film is so of the best films of the year with ', 'the film has a number of themes a complex on a good ', 'the film is a primer on its own it s a of above the ']","['the film is a primer on sentence of the film a movie ', 'the film is so many that its through the film s mid ', 'the film is a contrivance as aificial as the film ']","{'primer': 0.15384615384615385, 'many': 0.07692307692307693, 'face': 0.07692307692307693, 'favor': 0.07692307692307693, 'healthy': 0.07692307692307693}","{'primer': 0.16666666666666666, 'sentence': 0.16666666666666666, 'many': 0.16666666666666666, 'mid': 0.16666666666666666, 'contrivance': 0.16666666666666666}"
36,the best thing that can be said of the picture is that it does have a few cute moments,0,the best thing that can be said of the picture is that it does have a few cute moments,1,1,0.9523809523809523,"['the film is a primer on the beach with humor and american ', 'the film is a primer on the rules of popularity of ', 'the film is so of those who try to look away from ', 'the film has a laundry exercise in style and roll ', 'the film is a primer on its own and director michael ']","['the film is a primer on its own animated tv in which ', 'the film is too many or even video it s got a movie ', 'the film is a contrivance as aificial as the movie ', 'the film is a primer on sentence of the film a movie ']","{'primer': 0.17647058823529413, 'beach': 0.058823529411764705, 'humor': 0.058823529411764705, 'american': 0.058823529411764705, 'rules': 0.058823529411764705}","{'primer': 0.18181818181818182, 'animated': 0.09090909090909091, 'tv': 0.09090909090909091, 'many': 0.09090909090909091, 'even': 0.09090909090909091}"
37,jones helps breathe some life into the insubstantial plot but even he is overwhelmed by predictability,0,jones helps breathe some life into the insubstantial plot but even he is overwhelmed by predictability,1,1,0.972972972972973,"['it s a very tasteful to look at it s so devoid of ', 'the film is a primer on its own and director michael ', 'the film is a primer on its observation and fills ', 'the film is a primer on its own it s a of above the ', 'the film has a number of themes a complex on a good ']","['the film is a primer on its own it fills a good movie ', 'the film is a primer on its own animated tv director ', 'the film is so of the 70s or film in which it s performance ']","{'primer': 0.21428571428571427, 'tasteful': 0.07142857142857142, 'look': 0.07142857142857142, 'devoid': 0.07142857142857142, 'director': 0.07142857142857142}","{'primer': 0.2222222222222222, 'fills': 0.1111111111111111, 'good': 0.1111111111111111, 'animated': 0.1111111111111111, 'tv': 0.1111111111111111}"
38,anyone who suffers through this film deserves at the very least a big box of consolation candy,0,anyone who suffers through this film deserves at the very least a big box of consolation candy,1,1,1.0,"['the film has a contrivance as aificial as the film ', 'the film is so of those who try to look at but it ', 'the film is a primer on the beach with humor and humor ', 'the film is a primer on the film s delicate little ', 'the film is so many that it wants to look like it ']","['the film is so of the 70s or film in which it s performance ', 'the film is so of the 70s games film becomes bad dialogue ', 'the film is a primer on its own hollywood director ']","{'look': 0.13333333333333333, 'primer': 0.13333333333333333, 'humor': 0.13333333333333333, 'contrivance': 0.06666666666666667, 'aificial': 0.06666666666666667}","{'70s': 0.2, 'performance': 0.1, 'games': 0.1, 'becomes': 0.1, 'bad': 0.1}"
39,moderately involving despite bargain basement photography and hackneyed romance,0,moderately involving despite bargain basement photography and hackneyed romance,0,0,0.9746835443037974,"['the film s so uninspiring that could a giant enterprise ', 'a movie that one would have been exhausted by someone ', 'a movie that rare into a man who can not always in ', 'the film is a primer on its own his director and feels ', 'the film is a primer on its own and fills its characters ']","['the film s visceral and predictable realism with a ', 'the film s a gaudy bag of a icon that s career <end> ', 'the film is a primer on its head and fills it all ', 'the film s visceral and predictable above with a performance ', 'the film s so uninspiring that could a taste of the ']","{'primer': 0.11764705882352941, 'uninspiring': 0.058823529411764705, 'could': 0.058823529411764705, 'giant': 0.058823529411764705, 'enterprise': 0.058823529411764705}","{'visceral': 0.125, 'predictable': 0.125, 'realism': 0.0625, 'gaudy': 0.0625, 'bag': 0.0625}"
40,it recycles every clich about gays in what is essentially an extended soap opera,0,it recycles every clich about gays in what is essentially an extended soap opera,0,0,0.9772727272727273,"['a movie that rare into a man who can t seen it s not ', 'a movie that rare into a man who can not always in ', 'the film is a primer on sentence of the film a movie ', 'the film is so many that time audiences it would have ', 'the film is so of the 70s or film that makes it move ']","['the film is a primer on its own in town with sensitivity ', 'the film is a primer on its own it s a of above the ', 'the film is a primer on its own and director in its ', 'the film is so many of its observation and fills it ', 'the film is a primer on its own animated tv and in ']","{'rare': 0.13333333333333333, 'man': 0.13333333333333333, 'seen': 0.06666666666666667, 'always': 0.06666666666666667, 'primer': 0.06666666666666667}","{'primer': 0.3333333333333333, 'town': 0.08333333333333333, 'sensitivity': 0.08333333333333333, 'director': 0.08333333333333333, 'many': 0.08333333333333333}"
41,hilarious acidic brit comedy,1,hilarious acidic brit comedy,0,0,0.9849624060150376,"['the film is a primer on its beach with great dialogue ', 'the movie is a mediocre movie tale about a new movie ', 'the film s so anti mischievous dance tale from the ', 'the film s so predictable and are too many over <end> ', 'a movie that will enthrall the whole thing of a <end> ']","['the film s blatant is so good and its hea <end> ', 'the film s what is so of the human <end> ', 'the film s a gaudy bag of a icon that feels <end> ', 'the film is a solid and narrative but in the right ', 'a film that will enthrall the whole thing of a icon ']","{'tale': 0.125, 'primer': 0.0625, 'beach': 0.0625, 'great': 0.0625, 'dialogue': 0.0625}","{'icon': 0.13333333333333333, 'blatant': 0.06666666666666667, 'good': 0.06666666666666667, 'hea': 0.06666666666666667, 'human': 0.06666666666666667}"
42,sade is an engaging look at the controversial eponymous and fiercely atheistic hero,1,sade is an engaging look at the controversial eponymous and fiercely atheistic hero,1,1,1.0,"['the film is a primer on its own and director in years ', 'the film is a primer on its own it s a of healthy ', 'the film is a primer on its own it fills a film above ', 'the film is so of the 70s it would be adequately emphasized ', 'a movie that one of the best films of the year the ']","['a movie that one would have been seen in advance or ', 'the film s so uninspiring that could a giant enterprise ', 'a movie that rare into a man who can not always in ']","{'primer': 0.2, 'director': 0.06666666666666667, 'years': 0.06666666666666667, 'healthy': 0.06666666666666667, 'fills': 0.06666666666666667}","{'one': 0.09090909090909091, 'would': 0.09090909090909091, 'seen': 0.09090909090909091, 'advance': 0.09090909090909091, 'uninspiring': 0.09090909090909091}"
43,flashy gadgets and whirling fight sequences may look cool but they can t distract from the flawed suppo structure holding equilibrium up,0,flashy gadgets and whirling fight sequences may look cool but they can t distract from the flawed suppo structure holding equilibrium up,1,1,1.0,"['flashy gadgets and whirling fight sequences may look cool but they can t distract from the flawed suppo structure holding equilibrium up', 'the film is so consistently that the impoance of life ', 'the film is so of the reassuring examples of a pseudo ', 'the film has a laundry exercise in camera and that ', 'the film is a primer on the beach with humor and humor ']","['the film is so of the 70s or film in which it s performance ', 'the film is a primer on its own hollywood director ', 'the film is a contrivance as aificial as the film ', 'the film is so many that its through the film s mid ']","{'humor': 0.07407407407407407, 'flashy': 0.037037037037037035, 'gadgets': 0.037037037037037035, 'whirling': 0.037037037037037035, 'fight': 0.037037037037037035}","{'70s': 0.1111111111111111, 'performance': 0.1111111111111111, 'primer': 0.1111111111111111, 'hollywood': 0.1111111111111111, 'director': 0.1111111111111111}"
44,the audience when i saw this one was chuckling at all the wrong times and that s a bad sign when they re supposed to be having a collective hea attack,0,the audience when i saw this one was chuckling at all the wrong times and that s a bad sign when they re supposed to be having a collective hea attack,0,0,0.9423076923076923,"['the film has the perfect characters are not to compromise ', 'the film is too many out of these or historical moments ', 'the film has been in years old but director s a bad ', 'the film has the perfect characters are not to lend ', 'the audience when i saw this one was chuckling at all the wrong times and that s a bad sign when they re supposed to be having a collective hea attack']","['the film has the heavy handed that takes up with the ', 'the film has the perfect characters are not much of ', 'the film has been a huge fan of human with black comedy ', 'the film has the heavy handed that takes up with a ', 'the film has a laundry exercise in camera with action ']","{'perfect': 0.08, 'characters': 0.08, 'bad': 0.08, 'compromise': 0.04, 'many': 0.04}","{'heavy': 0.1111111111111111, 'handed': 0.1111111111111111, 'takes': 0.1111111111111111, 'perfect': 0.05555555555555555, 'characters': 0.05555555555555555}"
45,in the spirit of the season i assign one bright shining star to robeo benigni s pinocchio but i guarantee that no wise men will be following after it,0,in the spirit of the season i assign one bright shining star to robeo benigni s pinocchio but i guarantee that no wise men will be following after it,0,0,0.9361702127659575,"['the film has the perfect characters are too many of ', 'the film is a contrivance as aificial as the film ', 'the film is too many out of these or historical moments ', 'the film is too many out of these guys are john in ', 'the film is a primer on a movie that should be better ']","['the film is a primer on its own director director ', 'the film has an infectious enthusiasm and we re touched ', 'the film is a primer on the beach with humor and american ', 'the film is so of those films that is a kind of nostalgic ', 'the film is a primer on the rules of attraction and ']","{'many': 0.23076923076923078, 'perfect': 0.07692307692307693, 'characters': 0.07692307692307693, 'contrivance': 0.07692307692307693, 'aificial': 0.07692307692307693}","{'primer': 0.1875, 'director': 0.125, 'infectious': 0.0625, 'enthusiasm': 0.0625, 'touched': 0.0625}"
46,escapism in its purest form,1,escapism in its purest form,1,1,0.967479674796748,"['the film is a primer on its own and director in years ', 'the film is a solid and unsentimental tale than the ', 'the film is a solid and narrative but not a better ', 'the film s a gaudy bag of stale candy ever made a ', 'escapism in its purest form']","['the film s visceral and predictable honest and the ', 'the film s so uninspiring that could a gorgeously ', 'the film s so predictable and just plain detailed ', 'the film is a primer on its own his director and feels ', 'a movie that so tale about being it s not devoid of ']","{'solid': 0.1111111111111111, 'primer': 0.05555555555555555, 'director': 0.05555555555555555, 'years': 0.05555555555555555, 'unsentimental': 0.05555555555555555}","{'predictable': 0.14285714285714285, 'visceral': 0.07142857142857142, 'honest': 0.07142857142857142, 'uninspiring': 0.07142857142857142, 'could': 0.07142857142857142}"
47,it s not just the vampires that are damned in queen of the damned the viewers will feel they suffer the same fate,0,it s not just the vampires that are damned in queen of the damned the viewers will feel they suffer the same fate,0,0,0.9782608695652174,"['the film has a contrivance as aificial as the exalted ', 'the film is so consistently unimaginative that doesn ', 'the film is a contrivance as aificial as the film ', 'the film is too many out of these or historical moments ', 'the film is a primer on its own hollywood director ']","['the film is a primer on the beach with humor and humor ', 'the film has a laundry exercise in camera with action ', 'the film is a primer on the rules of popularity of ', 'the film is a primer on its own it s a rewarding balance ', 'the film is so many that it wants to look like it ']","{'contrivance': 0.15384615384615385, 'aificial': 0.15384615384615385, 'exalted': 0.07692307692307693, 'consistently': 0.07692307692307693, 'unimaginative': 0.07692307692307693}","{'primer': 0.16666666666666666, 'humor': 0.1111111111111111, 'beach': 0.05555555555555555, 'laundry': 0.05555555555555555, 'exercise': 0.05555555555555555}"
