24,an old fashioned drama of substance about a teacher s slide down the slippery slope of dishonesty after an encounter with the rich and the powerful who have nothing but disdain for viue,1,an old fashioned drama of substance about a teacher s slide down the slippery slope of dishonesty after an encounter with the rich and the powerful who have nothing but disdain for viue,1,1,0.9803921568627451,"['the film has the perfect of s best as a couple of ', 'the film has a laundry cast of human business but ', 'the film has a laundry exercise in camera that you ', 'an old fashioned drama of substance about a teacher s slide down the slippery slope of dishonesty after an encounter with the rich and the powerful who have nothing but disdain for viue', 'the film has a laundry cast of human comedy with a ']","['the movie has been readily dismissed as the film was ', 'the film is a contrivance as aificial as the movie ', 'the movie has been in this is that rare drama that ']","{'laundry': 0.10344827586206896, 'cast': 0.06896551724137931, 'human': 0.06896551724137931, 'perfect': 0.034482758620689655, 'best': 0.034482758620689655}","{'readily': 0.16666666666666666, 'dismissed': 0.16666666666666666, 'contrivance': 0.16666666666666666, 'aificial': 0.16666666666666666, 'rare': 0.16666666666666666}",0.021551847457885742
25,it wouldn t be my preferred way of spending 100 minutes or 7 00,0,it wouldn t be my preferred way of spending 100 minutes or 7 00,0,0,0.9795918367346939,"['the film is a primer on its own and fills its characters ', 'the film is a primer on sentence of the film a movie ', 'a movie that one would be profane politically the ', 'a movie that rare into a man who can t seen it s not ', 'the film is a primer on its own it feels like a lot ']","['the film is a primer on its own in town with sensitivity ', 'the film is a primer on its own it s a of above the ', 'the film is a primer on its observation and fills ', 'a movie that so lovingly and present the most of screen ', 'the film is so many of its own in reality tv and his ']","{'primer': 0.1875, 'fills': 0.0625, 'characters': 0.0625, 'sentence': 0.0625, 'one': 0.0625}","{'primer': 0.23076923076923078, 'town': 0.07692307692307693, 'sensitivity': 0.07692307692307693, 'observation': 0.07692307692307693, 'fills': 0.07692307692307693}",0.03958868980407715
26,flawed but wohy look at life in u s relocation camps,1,flawed but wohy look at life in u s relocation camps,1,1,0.9629629629629629,"['a movie that so lovingly and present the one of screen ', 'the film is a primer on its own it s a of above its ', 'a movie that one of the best films of the year the ', 'a movie that so of the best films like a confidence ', 'a movie that one would be an intelligent and a movie ']","['a movie that rare into a man who can t seen it s not ', 'a movie that rare into the reunion of s a performance ', 'the film is so of the 70s or film in which it s performance ']","{'one': 0.1875, 'best': 0.125, 'films': 0.125, 'lovingly': 0.0625, 'present': 0.0625}","{'rare': 0.25, 'performance': 0.25, 'man': 0.125, 'seen': 0.125, 'reunion': 0.125}",0.021712064743041992
27,mckay seems embarrassed by his own invention and tries to rush through the intermediary passages apparently hoping that the audience will not notice the glaring triteness of the plot device he has put in service,0,mckay seems embarrassed by his own invention and tries to rush through the intermediary passages apparently hoping that the audience will not notice the glaring triteness of the plot device he has put in service,0,0,1.0,"['the movie has the perfect of water as a fascinating ', 'the movie has been in years old but director michael ', 'the movie has been in years old but even with the ', 'the movie has been in this is a movie that it would ', 'the movie has been readily dismissed as the website ']","['the film has a laundry list of war shocomings but ', 'the film has the perfect of s best films the characters ', 'the film has the perfect characters are not much of ', 'the film has a laundry cast of war shocomings are ', 'the film has an infectious enthusiasm and it s actually ']","{'years': 0.14285714285714285, 'old': 0.14285714285714285, 'perfect': 0.07142857142857142, 'water': 0.07142857142857142, 'fascinating': 0.07142857142857142}","{'laundry': 0.1111111111111111, 'war': 0.1111111111111111, 'shocomings': 0.1111111111111111, 'perfect': 0.1111111111111111, 'characters': 0.1111111111111111}",0.03726673126220703
28,director andrew niccol demonstrates a wry understanding of the quirks of fame his healthy sense of satire is light and fun,1,director andrew niccol demonstrates a wry understanding of the quirks of fame his healthy sense of satire is light and fun,1,1,1.0,"['the film is a primer on its own school comedy with ', 'the film is so consistently that the impoance of life ', 'the film is a primer on its own it s a of healthy ', 'the film has a contrivance as aificial as the film ', 'the film is a primer on its own time director peter ']","['the film is a primer on its own hollywood director ', 'the film is too many or even video it s got amateurish ', 'the film is a primer on sentence of the film a movie ']","{'primer': 0.21428571428571427, 'school': 0.07142857142857142, 'comedy': 0.07142857142857142, 'consistently': 0.07142857142857142, 'impoance': 0.07142857142857142}","{'primer': 0.2, 'hollywood': 0.1, 'director': 0.1, 'many': 0.1, 'even': 0.1}",0.02070784568786621
29,as pure over the top trash any john waters movie has it beat by a country mile,0,as pure over the top trash any john waters movie has it beat by a country mile,0,0,0.9512195121951219,"['the film is so of the 70s it would be better than ', 'the film is a primer on its own it feels like a lot ', 'the film is a primer on sentence of the film a movie ', 'the film is so of the 70s or film in which it s performance ', 'the film is so many of its own in reality tv in which ']","['a movie that so lovingly and present the one of screen ', 'it s a very tasteful to look at the most were what ', 'the film has a number of themes a complex on a good ', 'the film is a primer on its own it s a of above the ', 'the film is a primer on its own director director ']","{'70s': 0.14285714285714285, 'primer': 0.14285714285714285, 'would': 0.07142857142857142, 'better': 0.07142857142857142, 'feels': 0.07142857142857142}","{'primer': 0.14285714285714285, 'director': 0.14285714285714285, 'lovingly': 0.07142857142857142, 'present': 0.07142857142857142, 'one': 0.07142857142857142}",0.028005599975585938
30,rymer doesn t trust laughs and doesn t conjure proper respect for followers of the whole dead undead genre who deserve more from a vampire pic than a few shrieky special effects,0,rymer doesn t trust laughs and doesn t conjure proper respect for followers of the whole dead undead genre who deserve more from a vampire pic than a few shrieky special effects,0,0,0.9655172413793104,"['the film has the perfect characters are not to compromise ', 'the movie has been in years old but director michael ', 'the film has the perfect characters are too much but ', 'the film has been a huge fan of dickens in which is ', 'the film has been a huge that the movie it would have ']","['the film has a laundry cast of human business but ', 'the film has an infectious enthusiasm and it s altman ', 'the film has an infectious enthusiasm and it s actually ', 'the film has a laundry cast of human observation are ', 'the film has the heavy handed that takes up with the ']","{'perfect': 0.13333333333333333, 'characters': 0.13333333333333333, 'huge': 0.13333333333333333, 'compromise': 0.06666666666666667, 'years': 0.06666666666666667}","{'laundry': 0.11764705882352941, 'cast': 0.11764705882352941, 'human': 0.11764705882352941, 'infectious': 0.11764705882352941, 'enthusiasm': 0.11764705882352941}",0.052379608154296875
31,when de palma s bad he s really bad and femme fatale ranks with the worst he has done,0,when de palma s bad he s really bad and femme fatale ranks with the worst he has done,0,0,0.9534883720930233,"['the film is a primer on sentence of the film a movie ', 'the film is a contrivance as aificial as the film ', 'the film is a primer on its own animated tv and rather ', 'the film is a primer on its own hollywood director ', 'the film is too many out of these or historical moments ']","['the film is a primer on its own director director ', 'the film is a primer on the beach with humor and humor ', 'the film is a primer on the rules of attraction and ', 'the film is so of those who try to look away from ', 'the film is a primer on its own animated tv and in ']","{'primer': 0.21428571428571427, 'sentence': 0.07142857142857142, 'contrivance': 0.07142857142857142, 'aificial': 0.07142857142857142, 'animated': 0.07142857142857142}","{'primer': 0.25, 'director': 0.125, 'humor': 0.125, 'beach': 0.0625, 'rules': 0.0625}",0.03323507308959961
32,has its moments and almost as many subplots,0,has its moments and almost as many subplots,1,1,0.975,"['a movie that so of the highest and the most famous ', 'the film is a primer on its own it fills a good movie ', 'a movie that so of the energy and in mary format he ', 'the film is a primer on its observation and fills ', 'the film s visceral and its indulgent with a confidence ']","['the film is a primer on its own it feels like a character ', 'the film is a primer on its own his director and feels ', 'a movie that rare into a man who can t seen it s not ', 'the film s so uninspiring that covers a film impression ', 'the film s so predictable and just plain detailed ']","{'primer': 0.14285714285714285, 'fills': 0.14285714285714285, 'highest': 0.07142857142857142, 'famous': 0.07142857142857142, 'good': 0.07142857142857142}","{'primer': 0.125, 'feels': 0.125, 'like': 0.0625, 'character': 0.0625, 'director': 0.0625}",0.03395533561706543
33,sewer rats could watch this movie and be so skeeved out that they d need a shower,0,sewer rats could watch this movie and be so skeeved out that they d need a shower,0,0,0.9782608695652174,"['the film is a primer on its own and fills its characters ', 'a movie that rare into a man who can not mount a buyer ', 'the film is so many of its own in reality filmmaking ', 'the film is a primer on its own animated tv in which ', 'the film is a primer on its own it feels like a lot ']","['a movie that one of the best films of the situation ', 'a movie that so of the best films like a confidence ', 'it s a very tasteful to look at it s so devoid of ', 'the film is so many of its own in reality tv and his ', 'the film is a primer on its own it fills a good movie ']","{'primer': 0.17647058823529413, 'fills': 0.058823529411764705, 'characters': 0.058823529411764705, 'rare': 0.058823529411764705, 'man': 0.058823529411764705}","{'best': 0.11764705882352941, 'films': 0.11764705882352941, 'one': 0.058823529411764705, 'situation': 0.058823529411764705, 'like': 0.058823529411764705}",0.03272247314453125
34,directed without the expected flair or imagination by hong kong master john woo windtalkers airs just about every cliche in the war movie compendium across its indulgent two hour and fifteen minute length,0,directed without the expected flair or imagination by hong kong master john woo windtalkers airs just about every cliche in the war movie compendium across its indulgent two hour and fifteen minute length,0,0,1.0,"['the film has been a huge that the movie is one of ', 'the film has been a huge that his movie in stua is ', 'the film has been in years old but director s a bad ', 'the film has the perfect characters are not to lend ', 'the film is too many or even putting the toilet seat ']","['the film has the heavy handed that takes sophomoric ', 'the film has a laundry cast of war shocomings but ', 'the film has a laundry cast of movie references but ', 'the film has a laundry list of movie experiences will ', 'the film has a laundry exercise in camera work but ']","{'huge': 0.125, 'one': 0.0625, 'stua': 0.0625, 'years': 0.0625, 'old': 0.0625}","{'laundry': 0.2222222222222222, 'cast': 0.1111111111111111, 'heavy': 0.05555555555555555, 'handed': 0.05555555555555555, 'takes': 0.05555555555555555}",0.04502248764038086
35,an alternately raucous and sappy ethnic sitcom you d be wise to send your regrets,0,an alternately raucous and sappy ethnic sitcom you d be wise to send your regrets,1,1,0.95,"['the film is a primer on its own in town with action ', 'the film is a primer on its own it s a rewarding balance ', 'a movie that one of the best films of the situation ', 'the film is a primer on its own school comedy with ', 'the film is a primer on its observation and fills ']","['the film is a primer on its own it feels like a lot ', 'the film is a primer on sentence of the film a movie ']","{'primer': 0.25, 'town': 0.0625, 'action': 0.0625, 'rewarding': 0.0625, 'balance': 0.0625}","{'primer': 0.3333333333333333, 'feels': 0.16666666666666666, 'like': 0.16666666666666666, 'lot': 0.16666666666666666, 'sentence': 0.16666666666666666}",0.01877737045288086
36,the best thing that can be said of the picture is that it does have a few cute moments,0,the best thing that can be said of the picture is that it does have a few cute moments,1,1,0.9534883720930233,"['the film is a primer on the film s delicate little ', 'the film is so of those who try to look away from ', 'the film has a laundry exercise in camera with and ', 'the film is so of those films that is a kind of nostalgic ', 'the film is so of the best films of the year with ']","['the film is a primer on its own hollywood director ', 'the film is too many or even through the movie s of ', 'the film is too many out of these or historical moments ']","{'films': 0.13333333333333333, 'primer': 0.06666666666666667, 'delicate': 0.06666666666666667, 'little': 0.06666666666666667, 'try': 0.06666666666666667}","{'many': 0.25, 'primer': 0.125, 'hollywood': 0.125, 'director': 0.125, 'even': 0.125}",0.019842147827148438
37,jones helps breathe some life into the insubstantial plot but even he is overwhelmed by predictability,0,jones helps breathe some life into the insubstantial plot but even he is overwhelmed by predictability,1,1,0.9761904761904762,"['a movie that one of the best films of the year with ', 'the film is a primer on its own it s a of healthy ', 'the film is so of the best films of the year with ', 'the film is a primer on the rules of attraction and ', 'the film has a number of themes a house that a good ']","['a movie that one would be profane politically the ', 'the film is too many or sugary through to think that ', 'the film is so many of its own in reality tv in which ']","{'best': 0.125, 'films': 0.125, 'year': 0.125, 'primer': 0.125, 'one': 0.0625}","{'many': 0.2, 'one': 0.1, 'would': 0.1, 'profane': 0.1, 'politically': 0.1}",0.019600391387939453
38,anyone who suffers through this film deserves at the very least a big box of consolation candy,0,anyone who suffers through this film deserves at the very least a big box of consolation candy,1,1,0.9736842105263158,"['the film is so of the best films of the year with ', 'the film is a primer on its own it s a of healthy ', 'the film is a primer on its own and director michael ', 'the film is so many that it wants to look like it ', 'the film is a primer on its own director director ']","['the film has a number of themes a complex on a good ', 'the film is too many out of these or historical moments ', 'the film is too many or sugary through to think that ']","{'primer': 0.2, 'director': 0.2, 'best': 0.06666666666666667, 'films': 0.06666666666666667, 'year': 0.06666666666666667}","{'many': 0.2, 'number': 0.1, 'themes': 0.1, 'complex': 0.1, 'good': 0.1}",0.019667863845825195
39,moderately involving despite bargain basement photography and hackneyed romance,0,moderately involving despite bargain basement photography and hackneyed romance,0,0,0.9615384615384616,"['the film s visceral and predictable honest and the ', 'the film is a primer on its beach with great way or ', 'the film s so predictable and just plain detailed ', 'the film is a primer on its own his director and feels ', 'the film s so uninspiring that could a job to the ']","['the film s visceral and predictable tale of a icon ', 'the film s a gaudy album of weight is direction and ', 'a movie that so fresh and thoroughly but i d look ', 'the film s so of the year is a performance of a sweet ', 'the film is a primer on its own and director in its ']","{'predictable': 0.125, 'primer': 0.125, 'visceral': 0.0625, 'honest': 0.0625, 'beach': 0.0625}","{'visceral': 0.0625, 'predictable': 0.0625, 'tale': 0.0625, 'icon': 0.0625, 'gaudy': 0.0625}",0.12868261337280273
40,it recycles every clich about gays in what is essentially an extended soap opera,0,it recycles every clich about gays in what is essentially an extended soap opera,0,0,0.9761904761904762,"['the film is a primer on sentence of the film a movie ', 'a movie that rare into a man who can t seen it s not ', 'the film is a primer on its own it feels like a lot ', 'the film is so many of its own in reality tv in which ', 'the film is so many that its through the film s mid ']","['a movie that so of the best films like a confidence ', 'a movie that so of the highest and the most famous ', 'the film has a number of themes a complex on a good ', 'the film is a primer on its own it s a of above the ', 'it s a very tasteful rock and roll movie you can imagine ']","{'primer': 0.14285714285714285, 'many': 0.14285714285714285, 'sentence': 0.07142857142857142, 'rare': 0.07142857142857142, 'man': 0.07142857142857142}","{'best': 0.06666666666666667, 'films': 0.06666666666666667, 'like': 0.06666666666666667, 'confidence': 0.06666666666666667, 'highest': 0.06666666666666667}",0.035809993743896484
41,hilarious acidic brit comedy,1,hilarious acidic brit comedy,0,0,0.9772727272727273,"['a movie that will be an actor thriller about a movie ', 'the movie is a mediocre movie flick about a <end> ', 'the film s blatant is so predictable and its moments ', 'the film s blatant is so predictable and its dialogue ', 'a movie that will be a bit of a good time <end> ']","['the film s visceral and affection realism with a gritty ', 'a very funny look at how it used to be <end> ', 'the film s visceral and affection thriller with a ', 'a film that will do well acted and by someone who ', 'the film is a recycled and unsentimental look at the ']","{'blatant': 0.15384615384615385, 'predictable': 0.15384615384615385, 'actor': 0.07692307692307693, 'thriller': 0.07692307692307693, 'mediocre': 0.07692307692307693}","{'visceral': 0.125, 'affection': 0.125, 'look': 0.125, 'realism': 0.0625, 'gritty': 0.0625}",0.1678924560546875
42,sade is an engaging look at the controversial eponymous and fiercely atheistic hero,1,sade is an engaging look at the controversial eponymous and fiercely atheistic hero,1,1,0.9836065573770492,"['it s a very tasteful to look at the most were what ', 'the film is a primer on its own and director in its ', 'the film is so of the 70s s film in which with sensitivity ', 'a movie that so of the highest and the most famous ', 'the film s so uninspiring that even a of h blade 2 ']","['a movie that rare into a man who can t seen it s not ', 'a movie that one would be profane politically the ', 'the film is a primer on its own it feels like a lot ']","{'tasteful': 0.07692307692307693, 'look': 0.07692307692307693, 'primer': 0.07692307692307693, 'director': 0.07692307692307693, '70s': 0.07692307692307693}","{'rare': 0.09090909090909091, 'man': 0.09090909090909091, 'seen': 0.09090909090909091, 'one': 0.09090909090909091, 'would': 0.09090909090909091}",0.021117687225341797
43,flashy gadgets and whirling fight sequences may look cool but they can t distract from the flawed suppo structure holding equilibrium up,0,flashy gadgets and whirling fight sequences may look cool but they can t distract from the flawed suppo structure holding equilibrium up,1,1,0.9512195121951219,"['the film is a primer on the film s delicate little ', 'the film is a primer on its own it s a rewarding balance ', 'the film is so many that its through the film s mid ', 'the film is a primer on the rules of attraction and ', 'flashy gadgets and whirling fight sequences may look cool but they can t distract from the flawed suppo structure holding equilibrium up']","['the film is too many or even through the movie s of ', 'the film is a primer on sentence of the film a movie ', 'the film is a primer on a movie that should be better ']","{'primer': 0.12, 'delicate': 0.04, 'little': 0.04, 'rewarding': 0.04, 'balance': 0.04}","{'primer': 0.3333333333333333, 'many': 0.16666666666666666, 'even': 0.16666666666666666, 'sentence': 0.16666666666666666, 'better': 0.16666666666666666}",0.017929792404174805
44,the audience when i saw this one was chuckling at all the wrong times and that s a bad sign when they re supposed to be having a collective hea attack,0,the audience when i saw this one was chuckling at all the wrong times and that s a bad sign when they re supposed to be having a collective hea attack,0,0,0.9649122807017544,"['the film has the perfect characters are not to lend ', 'the film is a contrivance as aificial as the movie ', 'the film has been a huge fan of dickens in which is ', 'the film is too many out to crush the same ride that ', 'the film is a contrivance as aificial as the film ']","['the film has the heavy handed of haynes work in the ', 'the film has an infectious enthusiasm and it s simply ', 'the film has a laundry cast of human observation are ', 'the film has all the rules of lurid melodrama into ', 'the film is so of those films try to be missing from ']","{'contrivance': 0.15384615384615385, 'aificial': 0.15384615384615385, 'perfect': 0.07692307692307693, 'characters': 0.07692307692307693, 'lend': 0.07692307692307693}","{'heavy': 0.058823529411764705, 'handed': 0.058823529411764705, 'haynes': 0.058823529411764705, 'work': 0.058823529411764705, 'infectious': 0.058823529411764705}",0.03737282752990723
45,in the spirit of the season i assign one bright shining star to robeo benigni s pinocchio but i guarantee that no wise men will be following after it,0,in the spirit of the season i assign one bright shining star to robeo benigni s pinocchio but i guarantee that no wise men will be following after it,0,0,0.9736842105263158,"['the film is too many out of these guys are john in ', 'the film has the perfect characters are too much but ', 'the film has a contrivance as aificial as the exalted ', 'the film is too many or even video it s got to video ', 'the film is a primer on its own hollywood director ']","['the film is so of those who try to look away from ', 'the film is so of those films which is a brand of ', 'the film is so many of the time it s so bad that it ', 'the film is so consistently that the impoance of human ', 'the film has a laundry list of movie largely for the ']","{'many': 0.11764705882352941, 'video': 0.11764705882352941, 'guys': 0.058823529411764705, 'john': 0.058823529411764705, 'perfect': 0.058823529411764705}","{'try': 0.07142857142857142, 'look': 0.07142857142857142, 'away': 0.07142857142857142, 'films': 0.07142857142857142, 'brand': 0.07142857142857142}",0.02727675437927246
46,escapism in its purest form,1,escapism in its purest form,1,1,0.992,"['the film is a mediocre movie tale about a good time ', 'the film is a primer on its own and director in his ', 'a movie that so fresh and thoroughly but el is foreign ', 'the film is a solid action thriller that is a pleasant ', 'the film is a very funny look at the most of these ']","['the film is a primer on its own his director and feels ', 'the film s so predictable and are rolling over the ', 'the film s so predictable and just plain detailed ', 'a movie that so tale about being it s not quite clever ', 'a movie that rare film about every to u s presentation ']","{'mediocre': 0.0625, 'tale': 0.0625, 'good': 0.0625, 'time': 0.0625, 'primer': 0.0625}","{'predictable': 0.13333333333333333, 'primer': 0.06666666666666667, 'director': 0.06666666666666667, 'feels': 0.06666666666666667, 'rolling': 0.06666666666666667}",0.03464508056640625
47,it s not just the vampires that are damned in queen of the damned the viewers will feel they suffer the same fate,0,it s not just the vampires that are damned in queen of the damned the viewers will feel they suffer the same fate,0,0,0.9714285714285714,"['the film is too many or even video it s got a movie ', 'the film is too many or even through the movie s of ', 'the film is a primer on a movie that should be better ', 'the film is a contrivance as aificial as the film ', 'the film is a primer on its own hollywood director ']","['the film is a primer on its own director director ', 'the film is so of those who try to look away from ', 'the film has a laundry exercise in camera with action ', 'the film is so many that it wants to look like it ']","{'many': 0.15384615384615385, 'even': 0.15384615384615385, 'primer': 0.15384615384615385, 'video': 0.07692307692307693, 'got': 0.07692307692307693}","{'director': 0.14285714285714285, 'look': 0.14285714285714285, 'primer': 0.07142857142857142, 'try': 0.07142857142857142, 'away': 0.07142857142857142}",0.025414705276489258
