index,original text,true class,decoded text,black box prediction,decision tree prediction,fidelity,exemplars,counter exemplars,top exemplar words,top counter exemplar words,time to generate
0,windtalkers celebrates the human spirit and packs an emotional wallop,1,windtalkers celebrates the human spirit and packs an emotional wallop,1,1,0.9736842105263158,"['the film s so uninspiring that could a taste of the ', 'a film that so fresh and thoroughly but el great film ', 'a movie that so of the highest and the most famous ', 'the film is a primer on its beach with great dialogue ', 'the film is a solid album of grace and direction over ']","['the film s so uninspiring that could a gorgeously ', 'the film is a primer on its own it feels like a lot ', 'a movie that one would have been seen in advance or ', 'a movie that so of the energy than a romantic comedy ']","{'great': 0.11764705882352941, 'uninspiring': 0.058823529411764705, 'could': 0.058823529411764705, 'taste': 0.058823529411764705, 'fresh': 0.058823529411764705}","{'uninspiring': 0.07142857142857142, 'could': 0.07142857142857142, 'gorgeously': 0.07142857142857142, 'primer': 0.07142857142857142, 'feels': 0.07142857142857142}",0.023525476455688477
1,filmmakers have to dig deep to sink this low founately for all involved this movie is likely to disappear as quickly as an ice cube thrown into a pot of boiling water,0,filmmakers have to dig deep to sink this low founately for all involved this movie is likely to disappear as quickly as an ice cube thrown into a pot of boiling water,0,0,1.0,"['the film is too many or even through the movie s of ', 'the film has the perfect characters are too much but ', 'the film is so many of the time it s so bad that it ', 'the film has the perfect characters are not to compromise ', 'the film is too many out of these guys are john in ']","['the film has a laundry exercise in camera work but ', 'the film has the perfect characters are not much of ', 'the film is a primer on its own director director ', 'the film has an infectious enthusiasm and we re touched ', 'the film has a laundry exercise in camera with action ']","{'many': 0.21428571428571427, 'perfect': 0.14285714285714285, 'characters': 0.14285714285714285, 'even': 0.07142857142857142, 'much': 0.07142857142857142}","{'laundry': 0.11764705882352941, 'exercise': 0.11764705882352941, 'camera': 0.11764705882352941, 'director': 0.11764705882352941, 'work': 0.058823529411764705}",0.033556461334228516
2,what staed out as a taut contest of wills between bacon and theron deteriorates into a protracted and borderline silly chase sequence,0,what staed out as a taut contest of wills between bacon and theron deteriorates into a protracted and borderline silly chase sequence,1,1,0.972972972972973,"['it s a very tasteful rock and roll movie you could ', 'it s a very tasteful to look at it s so devoid of ', 'the film is so many of its own in reality tv and his ', 'the film is a primer on the rules of attraction and ', 'the film is a primer on its own it s a of above the ']","['the film is a primer on its own and fills its characters ', 'the film is a primer on its own school comedy with ', 'the film is so many that its through the film s mid ']","{'tasteful': 0.14285714285714285, 'primer': 0.14285714285714285, 'rock': 0.07142857142857142, 'roll': 0.07142857142857142, 'could': 0.07142857142857142}","{'primer': 0.25, 'fills': 0.125, 'characters': 0.125, 'school': 0.125, 'comedy': 0.125}",0.020633935928344727
3,a mean spirited film made by someone who surely read the catcher in the rye but clearly suffers from dyslexia,0,a mean spirited film made by someone who surely read the catcher in the rye but clearly suffers from dyslexia,0,0,0.9565217391304348,"['the film is a primer on its own animated tv in which ', 'the film is a primer on its own hollywood director ', 'the film is a primer on its own animated tv and rather ', 'the film is a primer on sentence of the film a movie ', 'the film is too many that its scenes in reality of ']","['the film is so of the 70s it would be better than ', 'the film is a primer on its own it fills a good movie ', 'the film is a primer on its own and director michael ', 'the film is a primer on its own it s a of healthy ', 'the film is so consistently that the impoance of human ']","{'primer': 0.26666666666666666, 'animated': 0.13333333333333333, 'tv': 0.13333333333333333, 'hollywood': 0.06666666666666667, 'director': 0.06666666666666667}","{'primer': 0.21428571428571427, '70s': 0.07142857142857142, 'would': 0.07142857142857142, 'better': 0.07142857142857142, 'fills': 0.07142857142857142}",0.03165793418884277
4,sma funny and just honest enough to provide the pleasures of a slightly naughty just above average off broadway play,1,sma funny and just honest enough to provide the pleasures of a slightly naughty just above average off broadway play,0,0,0.9767441860465116,"['the film is a primer on sentence of the film a movie ', 'the film is a primer on its own hollywood director ', 'the film is too many or even video it s stuffy and ', 'the film is a primer on its own animated tv director ', 'the film has a contrivance as aificial as the exalted ']","['the film is a primer on its own it s a rewarding balance ', 'the film is a primer on the beach with humor and humor ', 'the film is so many that it wants to look like it ', 'the film is so of those films try to be missing from ', 'the film is a primer on the film s delicate little ']","{'primer': 0.1875, 'director': 0.125, 'sentence': 0.0625, 'hollywood': 0.0625, 'many': 0.0625}","{'primer': 0.17647058823529413, 'humor': 0.11764705882352941, 'rewarding': 0.058823529411764705, 'balance': 0.058823529411764705, 'beach': 0.058823529411764705}",0.03548598289489746
5,it s difficult for a longtime admirer of his work to not be swept up in invincible and overlook its drawbacks,0,it s difficult for a longtime admirer of his work to not be swept up in invincible and overlook its drawbacks,0,0,1.0,"['the film is a primer on its own it feels like a lot ', 'the film is a primer on its own animated tv in which ', 'the film is a primer on its own hollywood director ', 'the film is a primer on its own animated tv director ', 'the film is so many of its own in reality tv in which ']","['it s a very tasteful rock and roll movie you could ', 'the film is so of the 70s it would be adequately emphasized ', 'it s a very tasteful to look at the most were what ', 'the film is so many of its own in reality filmmaking ', 'the film is so many that it wants to look like it ']","{'primer': 0.23529411764705882, 'tv': 0.17647058823529413, 'animated': 0.11764705882352941, 'director': 0.11764705882352941, 'feels': 0.058823529411764705}","{'tasteful': 0.11764705882352941, 'look': 0.11764705882352941, 'many': 0.11764705882352941, 'rock': 0.058823529411764705, 'roll': 0.058823529411764705}",0.032885074615478516
6,feels like six different movies fighting each other for attention,0,feels like six different movies fighting each other for attention,0,0,0.9545454545454546,"['a movie that one would have been seen in advance or ', 'a movie that rare into a red bridge is a poem to the ', 'a movie that so of the energy than a romantic comedy ', 'a movie that one would have been seen the performers ', 'a movie that rare into a man who can t seen it s not ']","['a movie that so lovingly and present the most of screen ', 'the film s so uninspiring that even a of healthy blade ', 'the film is a primer on its own animated tv and in ', 'the film s so uninspiring that could a taste of the ', 'a movie that one of the best films of the year the ']","{'seen': 0.16666666666666666, 'one': 0.1111111111111111, 'would': 0.1111111111111111, 'rare': 0.1111111111111111, 'advance': 0.05555555555555555}","{'uninspiring': 0.11764705882352941, 'lovingly': 0.058823529411764705, 'present': 0.058823529411764705, 'screen': 0.058823529411764705, 'even': 0.058823529411764705}",0.057704925537109375
7,its scenes and sensibility are all more than familiar but it exudes a kind of nostalgic spy movie charm and at the same time is so fresh and free of the usual thriller nonsense that it all seems to be happening for the first time,1,its scenes and sensibility are all more than familiar but it exudes a kind of nostalgic spy movie charm and at the same time is so fresh and free of the usual thriller nonsense that it all seems to be happening for the first time,0,0,1.0,"['the movie has been in this is a movie that it would ', 'the movie has been in years old but even as they re ', 'the movie has been a huge that his movie it would ', 'the movie has been a huge that his genre in stua little ', 'the movie has been a huge that the film it would have ']","['the movie has the fact of the best examples of a house ', 'the movie has the fact that the best only some of ', 'the film has the number of s a remarkably listless ', 'the movie has the perfect of water as a great film ', 'the film has a laundry cast of war shocomings but ']","{'would': 0.25, 'huge': 0.25, 'years': 0.08333333333333333, 'old': 0.08333333333333333, 'even': 0.08333333333333333}","{'fact': 0.125, 'best': 0.125, 'examples': 0.0625, 'house': 0.0625, 'number': 0.0625}",0.03065180778503418
8,this is as powerful a set of evidence as you ll ever find of why a matters and how it can resonate far beyond museum walls and through to the most painfully marginal lives,1,this is as powerful a set of evidence as you ll ever find of why a matters and how it can resonate far beyond museum walls and through to the most painfully marginal lives,1,1,0.9827586206896551,"['the film has the heavy handed that takes up with a ', 'the film has a laundry cast of human observation and ', 'the film has a laundry cast of human comedy that it ', 'the film has a laundry cast of war observation moments ', 'the film has the perfect of s best and the characters ']","['the film has the perfect characters are not to compromise ', 'the film is a contrivance as aificial as the film ', 'the film is a contrivance as aificial as the movie ']","{'laundry': 0.15789473684210525, 'cast': 0.15789473684210525, 'human': 0.10526315789473684, 'observation': 0.10526315789473684, 'heavy': 0.05263157894736842}","{'contrivance': 0.2857142857142857, 'aificial': 0.2857142857142857, 'perfect': 0.14285714285714285, 'characters': 0.14285714285714285, 'compromise': 0.14285714285714285}",0.025801658630371094
9,pretty much sucks but has a funny moment or two,0,pretty much sucks but has a funny moment or two,0,0,1.0,"['a movie that one would have been seen the performers ', 'a movie that so tale about being a bunch of time in ', 'the film is a primer on sentence of the film a movie ', 'a movie that rare into a man who can not always in ', 'a movie that rare film about every to u s career to ']","['the film is a primer on its own in town with sensitivity ', 'the film s so uninspiring that could a taste of the ', 'the film is a primer on its own and fills his film ', 'the film s so uninspiring that even a of above the ', 'the film is a primer on its own and director in moulin ']","{'rare': 0.125, 'one': 0.0625, 'would': 0.0625, 'seen': 0.0625, 'performers': 0.0625}","{'primer': 0.23076923076923078, 'uninspiring': 0.15384615384615385, 'town': 0.07692307692307693, 'sensitivity': 0.07692307692307693, 'could': 0.07692307692307693}",0.06377959251403809
10,topkapi this is not,0,topkapi this is not,0,0,0.9765625,"['a movie that will enthrall the whole thing over too ', 'the film s so predictable and are rolling over in ', 'the film is a mediocre movie tale about a great movie ', 'a movie that one would have been exhausted by a pristine ', 'a film that will enthrall the whole thing and just ']","['the film s visceral and predictable above with a of ', 'the film s visceral and predictable above with a couple ', 'the film s visceral and affection realism with a confidence ', 'the film is a mediocre movie tale about a good time ', 'the film s so of the reassuring adaptation of a with ']","{'enthrall': 0.13333333333333333, 'whole': 0.13333333333333333, 'thing': 0.13333333333333333, 'predictable': 0.06666666666666667, 'rolling': 0.06666666666666667}","{'visceral': 0.2, 'predictable': 0.13333333333333333, 'couple': 0.06666666666666667, 'affection': 0.06666666666666667, 'realism': 0.06666666666666667}",0.17217087745666504
11,belongs to daniel day lewis as much as it belongs to main scorsese it s a memorable performance in a big brassy disturbing unusual and highly successful film,1,belongs to daniel day lewis as much as it belongs to main scorsese it s a memorable performance in a big brassy disturbing unusual and highly successful film,1,1,0.9285714285714286,"['the film has an infectious enthusiasm and it s so ', 'the film has a laundry exercise in camera work but ', 'the film has a laundry cast of movie references but ', 'the film has a laundry cast of human observation and ', 'the film is a primer on its own director director ']","['the film has the perfect characters are too much but ', 'the film is a contrivance as aificial as the movie ', 'the film is a contrivance as aificial as the film ', 'the film is too many out of these guys are john in ']","{'laundry': 0.1875, 'cast': 0.125, 'director': 0.125, 'infectious': 0.0625, 'enthusiasm': 0.0625}","{'contrivance': 0.2, 'aificial': 0.2, 'perfect': 0.1, 'characters': 0.1, 'much': 0.1}",0.022637605667114258
12,disney s live action division has a history of releasing cinematic flotsam but this is one occasion when they have uneahed a rare gem,1,disney s live action division has a history of releasing cinematic flotsam but this is one occasion when they have uneahed a rare gem,1,1,0.9473684210526315,"['the film is a primer on its own director director ', 'the film is a primer on its own school comedy with ', 'the film has been in years old but through this is ', 'the film is a primer on its own time director peter ', 'the film is too many or even through the movie s mid ']","['the film is a primer on its own hollywood director ', 'the film is too many or sugary through to think that ', 'the film is a contrivance as aificial as the movie ']","{'primer': 0.2, 'director': 0.2, 'school': 0.06666666666666667, 'comedy': 0.06666666666666667, 'years': 0.06666666666666667}","{'primer': 0.125, 'hollywood': 0.125, 'director': 0.125, 'many': 0.125, 'sugary': 0.125}",0.01970195770263672
13,innocuous enough to make even jean claude van damme look good,0,innocuous enough to make even jean claude van damme look good,1,1,0.9672131147540983,"['a movie that so lovingly and present the most of screen ', 'the film is a primer on its own and director in years ', 'it s a very tasteful rock and roll movie you could ', 'a thoughtful movie one of s best and in which as a ', 'it s a very tasteful to look at it s so devoid of ']","['a movie that one would have been seen the performers ', 'the film is a primer on its own and fills its characters ', 'the film is a primer on its own hollywood director ']","{'tasteful': 0.125, 'lovingly': 0.0625, 'present': 0.0625, 'screen': 0.0625, 'primer': 0.0625}","{'primer': 0.2, 'one': 0.1, 'would': 0.1, 'seen': 0.1, 'performers': 0.1}",0.023142576217651367
14,the hot topics of the plot are relegated to the background a welcome step forward from the sally jesse raphael atmosphere of films like philadelphia and american beauty,1,the hot topics of the plot are relegated to the background a welcome step forward from the sally jesse raphael atmosphere of films like philadelphia and american beauty,1,1,0.9387755102040817,"['the film has an infectious enthusiasm and it s so ', 'the film has a laundry cast of human observation and ', 'the film has the heavy handed that takes up with the ', 'the film is a primer on its own director director ', 'the film has all the rules of water melodrama which ']","['the film is too many out to crush the same ride that ', 'the film is a contrivance as aificial as the film ', 'the film has the perfect characters are too much but ']","{'director': 0.13333333333333333, 'infectious': 0.06666666666666667, 'enthusiasm': 0.06666666666666667, 'laundry': 0.06666666666666667, 'cast': 0.06666666666666667}","{'many': 0.125, 'crush': 0.125, 'ride': 0.125, 'contrivance': 0.125, 'aificial': 0.125}",0.025779247283935547
15,merely and literally tosses around sex toys and offers half heaed paeans to empowerment that are repeatedly undercut by the brutality of the jokes most at women s expense,0,merely and literally tosses around sex toys and offers half heaed paeans to empowerment that are repeatedly undercut by the brutality of the jokes most at women s expense,0,0,0.9736842105263158,"['the film has the perfect characters are not to compromise ', 'the film is a contrivance as aificial as the film ', 'the film is so consistently unimaginative that doesn ', 'the film is a contrivance as aificial as the movie ', 'the film is too many out of these or historical moments ']","['the film has a laundry list of movie largely for the ', 'the film is a primer on its own school comedy with ', 'the film is a primer on its own director director ', 'the film is a primer on the rules of attraction and ', 'the film is so of those films try to be worrying about ']","{'contrivance': 0.16666666666666666, 'aificial': 0.16666666666666666, 'perfect': 0.08333333333333333, 'characters': 0.08333333333333333, 'compromise': 0.08333333333333333}","{'primer': 0.2, 'director': 0.13333333333333333, 'laundry': 0.06666666666666667, 'list': 0.06666666666666667, 'largely': 0.06666666666666667}",0.02740168571472168
16,ranges from laugh out loud hilarious to wonder what time it is tedious,1,ranges from laugh out loud hilarious to wonder what time it is tedious,0,0,1.0,"['a movie that rare into a man who can t seen it s not ', 'the film is a primer on sentence of the film a movie ', 'the film is a primer on its own and fills its characters ', 'the film is a primer on its own it feels like a lot ', 'the film is a primer on its own animated tv in which ']","['the film is a primer on its own in town with sensitivity ', 'a movie that so of the highest and the most famous ', 'the film is a primer on its own it s a of healthy ', 'a movie that so of the highest and the of povey to ', 'it s a very tasteful to look at the most were what ']","{'primer': 0.26666666666666666, 'rare': 0.06666666666666667, 'man': 0.06666666666666667, 'seen': 0.06666666666666667, 'sentence': 0.06666666666666667}","{'primer': 0.18181818181818182, 'highest': 0.18181818181818182, 'town': 0.09090909090909091, 'sensitivity': 0.09090909090909091, 'famous': 0.09090909090909091}",0.043686628341674805
17,beautifully crafted engaging filmmaking that should attract upscale audiences hungry for quality and a nostalgic twisty yarn that will keep them guessing,1,beautifully crafted engaging filmmaking that should attract upscale audiences hungry for quality and a nostalgic twisty yarn that will keep them guessing,1,1,0.95,"['the film is so consistently that the impoance of life ', 'the film is so of those films which there are moments ', 'the film is a primer on the beach with humor and humor ', 'the film is so of the best films of the year with ', 'the film is so of those who try to look away from ']","['the film is a primer on its own animated tv in which ', 'the film is a primer on its own and director michael ', 'the film is a primer on a movie that should be better ']","{'films': 0.13333333333333333, 'humor': 0.13333333333333333, 'consistently': 0.06666666666666667, 'impoance': 0.06666666666666667, 'life': 0.06666666666666667}","{'primer': 0.375, 'animated': 0.125, 'tv': 0.125, 'director': 0.125, 'michael': 0.125}",0.024959087371826172
18,it s funny as the old saying goes because it s true,1,it s funny as the old saying goes because it s true,1,1,1.0,"['a movie that so lovingly and present the one of screen ', 'the film is a primer on its own it s a of above its ', 'the film is a primer on its own it s a of healthy ', 'the film s so uninspiring that could a taste of the ', 'the film is a primer on its own and director in years ']","['a movie that so of the energy than a romantic comedy ', 'the film is a contrivance as aificial as the film ', 'a movie that one would have been seen the performers ']","{'primer': 0.23076923076923078, 'lovingly': 0.07692307692307693, 'present': 0.07692307692307693, 'one': 0.07692307692307693, 'screen': 0.07692307692307693}","{'energy': 0.1111111111111111, 'romantic': 0.1111111111111111, 'comedy': 0.1111111111111111, 'contrivance': 0.1111111111111111, 'aificial': 0.1111111111111111}",0.022327423095703125
19,nohe has made a decent intro documentary but he feels like a spectator and not a paicipant,0,nohe has made a decent intro documentary but he feels like a spectator and not a paicipant,0,0,0.975609756097561,"['a movie that so of the energy than a romantic comedy ', 'the film is a primer on its own it feels like a lot ', 'the film is a primer on sentence of the film a movie ', 'the film is a primer on its own hollywood director ', 'the film is so of the 70s or film in which it s performance ']","['a movie that so lovingly and present the most of screen ', 'the film is so of the 70s it would be adequately emphasized ', 'the film is a primer on its own and director in years ', 'a movie that so of the best films like a confidence ', 'the film is a primer on its own it fills a good movie ']","{'primer': 0.21428571428571427, 'energy': 0.07142857142857142, 'romantic': 0.07142857142857142, 'comedy': 0.07142857142857142, 'feels': 0.07142857142857142}","{'primer': 0.11764705882352941, 'lovingly': 0.058823529411764705, 'present': 0.058823529411764705, 'screen': 0.058823529411764705, '70s': 0.058823529411764705}",0.03442668914794922
20,kinnear gives a tremendous performance,1,kinnear gives a tremendous performance,1,1,0.9847328244274809,"['the film s visceral and predictable tale of a man ', 'a movie that so of the year with a generous cast who ', 'the film is a recycled new york fest of life and direction ', 'a film that so fresh and thoroughly but unremarkable ', 'the film is a primer on its own and director while ']","['the film s so predictable and are rolling over in ', 'a film that will enthrall the whole thing and just ', 'the film s so predictable and just plain detailed ', 'a fascinating movie that s neither ararat is an intelligent ', 'the film s so predictable and are rolling over the ']","{'visceral': 0.05555555555555555, 'predictable': 0.05555555555555555, 'tale': 0.05555555555555555, 'man': 0.05555555555555555, 'year': 0.05555555555555555}","{'predictable': 0.21428571428571427, 'rolling': 0.14285714285714285, 'enthrall': 0.07142857142857142, 'whole': 0.07142857142857142, 'thing': 0.07142857142857142}",0.05644989013671875
21,a knowing look at female friendship spiked with raw urban humor,1,a knowing look at female friendship spiked with raw urban humor,1,1,0.967741935483871,"['the film is a primer on its own and director in america ', 'a movie that so lovingly and present the one of screen ', 'a movie that one of the best examples of a page to ', 'the film is a primer on its own it s a rewarding balance ', 'a movie that so of the energy and in which sexy he ']","['a movie that rare into a man who can not always in ', 'the film is so many of its own in reality tv in which ', 'the film is a primer on its own hollywood director ']","{'primer': 0.125, 'one': 0.125, 'director': 0.0625, 'america': 0.0625, 'lovingly': 0.0625}","{'rare': 0.1111111111111111, 'man': 0.1111111111111111, 'always': 0.1111111111111111, 'many': 0.1111111111111111, 'reality': 0.1111111111111111}",0.026669979095458984
22,one scene after another in this supposedly funny movie falls to the floor with a sickening thud,0,one scene after another in this supposedly funny movie falls to the floor with a sickening thud,0,0,0.9696969696969697,"['a movie that rare into a man who can t seen it s not ', 'the film is so many that its through the film s mid ', 'the film is a primer on sentence of the film a movie ', 'the film is a primer on its own animated tv and rather ', 'one scene after another in this supposedly funny movie falls to the floor with a sickening thud']","['a movie that rare into the reunion of s a performance ', 'the film is a primer on its own and director michael ', 'the film is so many of its own in reality tv and his ', 'a movie that one would be profane politically the ', 'the film is so of the best films of the year with ']","{'primer': 0.1, 'rare': 0.05, 'man': 0.05, 'seen': 0.05, 'many': 0.05}","{'rare': 0.0625, 'reunion': 0.0625, 'performance': 0.0625, 'primer': 0.0625, 'director': 0.0625}",0.026564359664916992
23,from its invitingly upbeat oveure to its pathos filled but ultimately life affirming finale main is a masterfully conducted work,1,from its invitingly upbeat oveure to its pathos filled but ultimately life affirming finale main is a masterfully conducted work,0,0,1.0,"['the film is a primer on sentence of the film a movie ', 'the film is so many of its own in reality tv in which ', 'the film is a primer on its own animated tv director ', 'the film is so many that its through the film s mid ', 'the film is a primer on its own animated tv in which ']","['the film is a primer on its own it fills a good movie ', 'it s a very tasteful to look at the most were what ', 'the film has a number of themes a complex on a good ', 'the film is a primer on its own director director ']","{'primer': 0.21428571428571427, 'tv': 0.21428571428571427, 'many': 0.14285714285714285, 'animated': 0.14285714285714285, 'sentence': 0.07142857142857142}","{'primer': 0.16666666666666666, 'good': 0.16666666666666666, 'director': 0.16666666666666666, 'fills': 0.08333333333333333, 'tasteful': 0.08333333333333333}",0.030208110809326172
