48,for those who are intrigued by politics of the 70s the film is every bit as fascinating as it is flawed,1,for those who are intrigued by politics of the 70s the film is every bit as fascinating as it is flawed,0,0,1.0,"['the film is a primer on a movie that should be better ', 'the film is a primer on sentence of the film a movie ', 'the film is a primer on its own animated tv director ', 'the film is too many or sugary issues in the least ', 'the film is a primer on its own hollywood director ']","['the film is a primer on its own animated tv and in ', 'the film is so many of its own in reality filmmaking ', 'the film is so many that it wants to look like it ', 'the film is a primer on its own school comedy with ']","{'primer': 0.26666666666666666, 'director': 0.13333333333333333, 'better': 0.06666666666666667, 'sentence': 0.06666666666666667, 'animated': 0.06666666666666667}","{'primer': 0.15384615384615385, 'many': 0.15384615384615385, 'animated': 0.07692307692307693, 'tv': 0.07692307692307693, 'reality': 0.07692307692307693}"
49,ah nuld s action hero days might be over,0,ah nuld s action hero days might be over,0,0,0.9433962264150944,"['a movie that one would have been exhausted by someone ', 'a movie that so of the energy than a romantic comedy ', 'a movie that so tale about being a bunch of time in ', 'a movie that rare into a man who can t seen it s not ', 'a movie that one would have been seen in advance or ']","['the film is a primer on its own his director and feels ', 'the film is a primer on its own his director in its ', 'a movie that one of the best films of the year with ', 'the film s so uninspiring that could a taste of the ', 'the film is a solid album of acting and direction ']","{'one': 0.11764705882352941, 'would': 0.11764705882352941, 'seen': 0.11764705882352941, 'exhausted': 0.058823529411764705, 'someone': 0.058823529411764705}","{'primer': 0.125, 'director': 0.125, 'feels': 0.0625, 'one': 0.0625, 'best': 0.0625}"
50,broomfield reveals an ironic manifestation of institutionalized slavery that ties a black owned record label with a white empowered police force,1,broomfield reveals an ironic manifestation of institutionalized slavery that ties a black owned record label with a white empowered police force,1,1,1.0,"['a movie that one of the best films of the year with ', 'the film is a primer on its own it fills a good movie ', 'it s a very tasteful rock and roll movie you could ', 'it s a very tasteful to look at the most were what ', 'the film is so of the 70s most of the film s with ']","['the film is a primer on sentence of the film a movie ', 'the film is a primer on its own it feels like a lot ']","{'tasteful': 0.14285714285714285, 'one': 0.07142857142857142, 'best': 0.07142857142857142, 'films': 0.07142857142857142, 'year': 0.07142857142857142}","{'primer': 0.3333333333333333, 'sentence': 0.16666666666666666, 'feels': 0.16666666666666666, 'like': 0.16666666666666666, 'lot': 0.16666666666666666}"
51,a compelling french psychological drama examining the encounter of an aloof father and his chilly son after 20 years apa,1,a compelling french psychological drama examining the encounter of an aloof father and his chilly son after 20 years apa,1,1,0.9545454545454546,"['the film is so many of its own in reality filmmaking ', 'the film is a primer on the rules of attraction and ', 'the film is a primer on its own and director michael ', 'the film is so consistently that the impoance of human ', 'the film is too many out of these or historical moments ']","['the film is a primer on its own animated tv in which ', 'the film is a contrivance as aificial as the film ', 'the film is a primer on a movie that should be better ']","{'many': 0.13333333333333333, 'primer': 0.13333333333333333, 'reality': 0.06666666666666667, 'filmmaking': 0.06666666666666667, 'rules': 0.06666666666666667}","{'primer': 0.2857142857142857, 'animated': 0.14285714285714285, 'tv': 0.14285714285714285, 'contrivance': 0.14285714285714285, 'aificial': 0.14285714285714285}"
52,what better message than love thyself could young women of any size receive,1,what better message than love thyself could young women of any size receive,0,0,0.9811320754716981,"['a movie that one would be profane politically the ', 'the film is a primer on its own and fills its characters ', 'the film is a primer on sentence of the film a movie ', 'a movie that rare into a man who can t seen it s not ', 'the film is so many that time audiences it would have ']","['a movie that rare into the reunion of s a performance ', 'the film is a primer on its own in town with sensitivity ', 'a movie that rare into a reunion of s a performance ', 'the film is so of the 70s it would be adequately emphasized ', 'the film is a primer on its own in town with action ']","{'would': 0.125, 'primer': 0.125, 'one': 0.0625, 'profane': 0.0625, 'politically': 0.0625}","{'rare': 0.125, 'reunion': 0.125, 'performance': 0.125, 'primer': 0.125, 'town': 0.125}"
53,a beguiling slow moving parable about the collision of past and present on a remote seacoast in iran,1,a beguiling slow moving parable about the collision of past and present on a remote seacoast in iran,1,1,1.0,"['the film is a primer on its own it fills a good movie ', 'the film is a primer on its own animated tv and in ', 'the film is so of the 70s it would be adequately emphasized ', 'the film is so of the best films of the year with ', 'the film is a primer on its own it s a rewarding balance ']","['the film is so many that its through the film s mid ', 'the film is a primer on its own animated tv director ']","{'primer': 0.1875, 'fills': 0.0625, 'good': 0.0625, 'animated': 0.0625, 'tv': 0.0625}","{'many': 0.16666666666666666, 'mid': 0.16666666666666666, 'primer': 0.16666666666666666, 'animated': 0.16666666666666666, 'tv': 0.16666666666666666}"
54,you needn t be steeped in 50s sociology pop culture or movie lore to appreciate the emotional depth of haynes work though haynes style apes films from the period its message is not rooted in that decade,1,you needn t be steeped in 50s sociology pop culture or movie lore to appreciate the emotional depth of haynes work though haynes style apes films from the period its message is not rooted in that decade,1,1,0.96,"['the film has the heavy handed of a house ambition ', 'the movie has been in this is that rare drama that ', 'the film has all the rules of his film bigelow the ', 'the film has a laundry cast of human comedy that it ', 'the film has an infectious enthusiasm and it s altman ']","['the movie has been readily dismissed as the website ', 'the film has the perfect characters are not to give ']","{'heavy': 0.06666666666666667, 'handed': 0.06666666666666667, 'house': 0.06666666666666667, 'ambition': 0.06666666666666667, 'rare': 0.06666666666666667}","{'readily': 0.16666666666666666, 'dismissed': 0.16666666666666666, 'website': 0.16666666666666666, 'perfect': 0.16666666666666666, 'characters': 0.16666666666666666}"
55,a chronicle not only of one man s quest to be president but of how that man single handedly turned a plane full of hard bitten cynical journalists into what was essentially by campaign s end an extended publicity depament,1,a chronicle not only of one man s quest to be president but of how that man single handedly turned a plane full of hard bitten cynical journalists into what was essentially by campaign s end an extended publicity depament,1,1,0.9622641509433962,"['the movie has been in this is that rare drama that ', 'the film has the perfect characters are not to lend ', 'the film has the number of s a similarly morose and ', 'the movie has the perfect of s best and the characters ', 'the movie has the fact of the best examples of his ']","['the movie has been in years old but even as the movie ', 'the movie has been in this one of human life but ultimately ', 'the movie has all the rules of attraction is realistic ', 'the movie has all the rules of attraction gets bigelow ', 'the movie has a laundry of a movie that i can be shaking ']","{'perfect': 0.14285714285714285, 'characters': 0.14285714285714285, 'best': 0.14285714285714285, 'rare': 0.07142857142857142, 'drama': 0.07142857142857142}","{'rules': 0.125, 'attraction': 0.125, 'years': 0.0625, 'old': 0.0625, 'even': 0.0625}"
56,one of the worst movies of the year,0,one of the worst movies of the year,0,0,0.9649122807017544,"['a movie that so tale about being a bunch of time in ', 'a movie that rare into a man who can not always in ', 'a movie that one would have been seen the performers ', 'a movie that rare into a man who can t seen it s not ', 'a movie that one would be profane politically the ']","['the film s a gaudy bag of stale candy ever made a ', 'a movie that so tale about three years ago and lucy ', 'a movie that rare into the reunion of and the 15 a ', 'a movie that one of the best films of the year the ', 'the film is so many of its own in reality tv and his ']","{'rare': 0.11764705882352941, 'man': 0.11764705882352941, 'one': 0.11764705882352941, 'would': 0.11764705882352941, 'seen': 0.11764705882352941}","{'gaudy': 0.047619047619047616, 'bag': 0.047619047619047616, 'stale': 0.047619047619047616, 'candy': 0.047619047619047616, 'ever': 0.047619047619047616}"
57,on a ceain base level blue crush delivers what it promises just not well enough to recommend it,0,on a ceain base level blue crush delivers what it promises just not well enough to recommend it,0,0,0.9523809523809523,"['the film is so many of its own in reality tv in which ', 'the film is too many or sugary through to think that ', 'the film is a primer on its own hollywood director ', 'the film is a primer on sentence of the film a movie ', 'the film is a primer on its own animated tv and rather ']","['the film is a primer on its own it s a rewarding balance ', 'the film is a primer on the film s delicate little ', 'the film is a primer on the rules of attraction and ', 'the film is a primer on the beach with humor and american ', 'the film is so consistently that the impoance of human ']","{'primer': 0.2, 'many': 0.13333333333333333, 'tv': 0.13333333333333333, 'reality': 0.06666666666666667, 'sugary': 0.06666666666666667}","{'primer': 0.25, 'rewarding': 0.0625, 'balance': 0.0625, 'delicate': 0.0625, 'little': 0.0625}"
58,frailty offers chills much like those that you get when sitting around a campfire around midnight telling creepy stories to give each other the willies and there s no way you won t be talking about the film once you exit the theater,1,frailty offers chills much like those that you get when sitting around a campfire around midnight telling creepy stories to give each other the willies and there s no way you won t be talking about the film once you exit the theater,0,0,0.9871794871794872,"['the movie has been more than a fair film but director ', 'the movie i have been lost in the most ride the film ', 'the movie i have been outrageous did not a look at ', 'the movie has the fact that the is a rewarding smug ', 'the movie has been in the rules of attraction and ']","['the movie has a laundry of the film s best and his ', 'the movie has the perfect of s best and the characters ', 'the movie has the perfect of s best and the film s ', 'the movie has the fact of the best examples of aful ', 'the movie has the fact of the best examples of his ']","{'fair': 0.09090909090909091, 'director': 0.09090909090909091, 'lost': 0.09090909090909091, 'ride': 0.09090909090909091, 'outrageous': 0.09090909090909091}","{'best': 0.35714285714285715, 'perfect': 0.14285714285714285, 'fact': 0.14285714285714285, 'examples': 0.14285714285714285, 'laundry': 0.07142857142857142}"
59,an exhilarating serving of movie fluff,1,an exhilarating serving of movie fluff,0,0,0.984251968503937,"['the film s blatant is one reason it s just too long ', 'a movie that will be a bit of a good time <end> ', 'a movie that will be a of a movie ultimately devoid ', 'the movie is a mediocre movie movie in a great raw ', 'the film s so anti jokes are off like 100 minutes ']","['a movie that makes for one of the best films <end> ', 'a very funny look at how it grows to be <end> ', 'the film is a primer on its own his director at life ', 'the film is a primer on its own his director at its ', 'a film that will enthrall the usual ground and delightfully ']","{'blatant': 0.058823529411764705, 'one': 0.058823529411764705, 'reason': 0.058823529411764705, 'long': 0.058823529411764705, 'bit': 0.058823529411764705}","{'primer': 0.125, 'director': 0.125, 'makes': 0.0625, 'one': 0.0625, 'best': 0.0625}"
60,so clich d that at one point they literally upset an apple ca,0,so clich d that at one point they literally upset an apple ca,1,1,1.0,"['the film is a primer on its own his director in its ', 'it s a very tasteful rock and roll movie you could ', 'a thoughtful movie that one of the most lies in a ', 'the film is a primer on its own in town with sensitivity ', 'a movie that rare into the reunion of s a performance ']","['the film is a primer on sentence of the film a movie ', 'a movie that so of the energy than a romantic comedy ', 'the film is so many that its through the film s mid ']","{'primer': 0.13333333333333333, 'director': 0.06666666666666667, 'tasteful': 0.06666666666666667, 'rock': 0.06666666666666667, 'roll': 0.06666666666666667}","{'primer': 0.14285714285714285, 'sentence': 0.14285714285714285, 'energy': 0.14285714285714285, 'romantic': 0.14285714285714285, 'comedy': 0.14285714285714285}"
61,the piano teacher is not an easy film it forces you to watch people doing unpleasant things to each other and themselves and it maintains a cool distance from its material that is deliberately unsettling,1,the piano teacher is not an easy film it forces you to watch people doing unpleasant things to each other and themselves and it maintains a cool distance from its material that is deliberately unsettling,1,1,1.0,"['the film has the perfect of s best films the characters ', 'the film has an infectious enthusiasm and the movie ', 'the film has been a huge fan of dickens in his actors ', 'the film has an infectious enthusiasm and it s simply ', 'the film has been a huge fan of dickens page one that ']","['the film has the perfect characters are not to compromise ', 'the movie has been readily dismissed as the website ', 'the film has the perfect characters are not to give ', 'the film has been a huge fan of dickens in which is ', 'the film has been a huge that the movie is one of ']","{'infectious': 0.1111111111111111, 'enthusiasm': 0.1111111111111111, 'huge': 0.1111111111111111, 'fan': 0.1111111111111111, 'dickens': 0.1111111111111111}","{'perfect': 0.14285714285714285, 'characters': 0.14285714285714285, 'huge': 0.14285714285714285, 'compromise': 0.07142857142857142, 'readily': 0.07142857142857142}"
62,friday after next is a lot more bluster than bite,0,friday after next is a lot more bluster than bite,0,0,0.9714285714285714,"['the film is a primer on its own his director and feels ', 'a movie that so of the energy in a of healthy tv s ', 'a movie that so of the energy than a romantic comedy ', 'a movie that one would have been seen in advance or ', 'a movie that so tale about being a bunch of time in ']","['the film is a solid album of acting and direction ', 'the film is a solid and unsentimental tale than the ', 'the film is a primer on its own and director in america ', 'the film is a solid album of writers the film is a ', 'a movie that so lovingly and present the most of screen ']","{'energy': 0.125, 'primer': 0.0625, 'director': 0.0625, 'feels': 0.0625, 'healthy': 0.0625}","{'solid': 0.1875, 'album': 0.125, 'acting': 0.0625, 'direction': 0.0625, 'unsentimental': 0.0625}"
63,stuffed to the brim with ideas american instigator michael moore s film is a rambling examination of american gun culture that uses his usual modus operandi of crucifixion through juxtaposition,1,stuffed to the brim with ideas american instigator michael moore s film is a rambling examination of american gun culture that uses his usual modus operandi of crucifixion through juxtaposition,1,1,0.9777777777777777,"['the film is so of those films try to be missing it ', 'the film is a primer on its own it s a rewarding balance ', 'the film has an infectious enthusiasm and we re touched ', 'the film has a laundry exercise in camera and that ', 'the film has a laundry exercise in camera with action ']","['the film is too many or even through the movie s mid ', 'the film is a contrivance as aificial as the film ', 'the film is so many of the time it s so bad that s ', 'the film is too many out of these or historical moments ']","{'laundry': 0.125, 'exercise': 0.125, 'camera': 0.125, 'films': 0.0625, 'try': 0.0625}","{'many': 0.2727272727272727, 'even': 0.09090909090909091, 'mid': 0.09090909090909091, 'contrivance': 0.09090909090909091, 'aificial': 0.09090909090909091}"
64,it s so devoid of joy and energy it makes even jason x look positively shakesperean by comparison,0,it s so devoid of joy and energy it makes even jason x look positively shakesperean by comparison,1,1,0.9545454545454546,"['the film is so of the 70s games film ever made about ', 'the film is a primer on its own time director peter ', 'the film is a primer on its own animated tv and in ', 'the film is a primer on its own school comedy with ', 'the film is a primer on its own animated tv and rather ']","['the film is a primer on sentence of the film a movie ', 'the film is a primer on its own director director ', 'the film is too many or even video it s got a movie ', 'the film is so many that its through the film s mid ']","{'primer': 0.2222222222222222, 'animated': 0.1111111111111111, 'tv': 0.1111111111111111, '70s': 0.05555555555555555, 'games': 0.05555555555555555}","{'primer': 0.18181818181818182, 'director': 0.18181818181818182, 'many': 0.18181818181818182, 'sentence': 0.09090909090909091, 'even': 0.09090909090909091}"
65,if there s nothing fresh about wannabes which was written by mr demeo who produced and directed the film with charles a addessi much of the time the movie feels authentic,1,if there s nothing fresh about wannabes which was written by mr demeo who produced and directed the film with charles a addessi much of the time the movie feels authentic,0,0,0.9433962264150944,"['the film has the perfect characters are not to compromise ', 'the film has been a huge that his movie in stua is ', 'the film is too many out of these guys are john in ', 'the film has all the rules of water melodrama which ', 'the film is too many out to crush the same ride that ']","['the film has a laundry exercise in camera that you ', 'the film has a laundry list of movie largely for the ', 'the film is so of those who try to look at but it ', 'the film has the heavy handed that takes up with a ', 'the film is so of those who try to look away from ']","{'many': 0.14285714285714285, 'perfect': 0.07142857142857142, 'characters': 0.07142857142857142, 'compromise': 0.07142857142857142, 'huge': 0.07142857142857142}","{'laundry': 0.14285714285714285, 'try': 0.14285714285714285, 'look': 0.14285714285714285, 'exercise': 0.07142857142857142, 'camera': 0.07142857142857142}"
66,a comprehensive and provocative film one that pushes the boundaries of biography and challenges its audience,1,a comprehensive and provocative film one that pushes the boundaries of biography and challenges its audience,1,1,0.9772727272727273,"['a movie that one of the best films of the situation ', 'the film is a contrivance as aificial as the film ', 'the film is so many of its own in reality tv and his ', 'the film is a primer on its own director director ', 'the film is a primer on its own it s a of above the ']","['a movie that one would be profane politically the ', 'the film is too many or even through the movie s of ', 'the film is a primer on its own animated tv in which ']","{'primer': 0.15384615384615385, 'director': 0.15384615384615385, 'one': 0.07692307692307693, 'best': 0.07692307692307693, 'films': 0.07692307692307693}","{'one': 0.1111111111111111, 'would': 0.1111111111111111, 'profane': 0.1111111111111111, 'politically': 0.1111111111111111, 'many': 0.1111111111111111}"
67,a modest masterpiece,1,a modest masterpiece,0,0,0.9923076923076923,"['the movie is a mediocre movie flick about a whole ', 'a movie that will be a mediocre movie is not a <end> ', 'the movie is a mediocre movie flick about a <end> ', 'the movie is a mediocre movie tale about a good time ', 'the film s so predictable and are too many over <end> ']","['a very funny look at how it s a pretty funny <end> ', 'the of the film is a pleasant enough and delightfully ', 'a movie that makes for good way to go <end> ', 'the film s hero is a of and misguided acts of affection ', 'the film s visceral and affection thriller with a ']","{'mediocre': 0.3333333333333333, 'flick': 0.16666666666666666, 'whole': 0.08333333333333333, 'tale': 0.08333333333333333, 'good': 0.08333333333333333}","{'funny': 0.1111111111111111, 'affection': 0.1111111111111111, 'look': 0.05555555555555555, 'pretty': 0.05555555555555555, 'pleasant': 0.05555555555555555}"
68,the setting is so cool that it chills the characters reducing our emotional stake in the outcome of intacto s dangerous and seductively stylish game,1,the setting is so cool that it chills the characters reducing our emotional stake in the outcome of intacto s dangerous and seductively stylish game,1,1,0.9787234042553191,"['the film is a primer on its own it s a of healthy ', 'the film is a primer on its own it s a rewarding balance ', 'the setting is so cool that it chills the characters reducing our emotional stake in the outcome of intacto s dangerous and seductively stylish game', 'the film is so many that it wants to look like it ', 'the film has a laundry exercise in camera with and ']","['the film is too many or even through the movie s mid ', 'the film is a contrivance as aificial as the film ', 'the film is a primer on sentence of the film a movie ', 'the film is so many of the time it s so bad that s ']","{'primer': 0.08, 'healthy': 0.04, 'rewarding': 0.04, 'balance': 0.04, 'setting': 0.04}","{'many': 0.2, 'even': 0.1, 'mid': 0.1, 'contrivance': 0.1, 'aificial': 0.1}"
69,for the first time in years de niro digs deep emotionally perhaps because he s been stirred by the powerful work of his co stars,1,for the first time in years de niro digs deep emotionally perhaps because he s been stirred by the powerful work of his co stars,1,1,0.9772727272727273,"['the film is so of the best films of the year with ', 'the film has a laundry exercise in camera with action ', 'the film is so consistently that the impoance of human ', 'for the first time in years de niro digs deep emotionally perhaps because he s been stirred by the powerful work of his co stars', 'the film is so many of its own in reality filmmaking ']","['the film is a contrivance as aificial as the film ', 'the film is too many out of these or historical moments ', 'the film is too many or even through the movie s of ', 'the film is too many or even through the movie s hero ']","{'best': 0.037037037037037035, 'films': 0.037037037037037035, 'year': 0.037037037037037035, 'laundry': 0.037037037037037035, 'exercise': 0.037037037037037035}","{'many': 0.3, 'even': 0.2, 'contrivance': 0.1, 'aificial': 0.1, 'historical': 0.1}"
70,a deliberative account of a lifestyle characterized by its surface obsession one that typifies the delirium of post pre and extant stardom,1,a deliberative account of a lifestyle characterized by its surface obsession one that typifies the delirium of post pre and extant stardom,1,1,0.95,"['a deliberative account of a lifestyle characterized by its surface obsession one that typifies the delirium of post pre and extant stardom', 'the film is a primer on its own it fills a good movie ', 'a movie that rare into the reunion of s a performance ', 'the film is a primer on its own and director in years ', 'the film is a primer on its own and director in its ']","['the film is a primer on sentence of the film a movie ', 'the film is so heavy handed symbolism dime in sorority ', 'the film is a primer on its own animated tv and rather ']","{'primer': 0.125, 'director': 0.08333333333333333, 'deliberative': 0.041666666666666664, 'account': 0.041666666666666664, 'lifestyle': 0.041666666666666664}","{'primer': 0.18181818181818182, 'sentence': 0.09090909090909091, 'heavy': 0.09090909090909091, 'handed': 0.09090909090909091, 'symbolism': 0.09090909090909091}"
71,we never feel anything for these characters and as a result the film is basically just a curiosity,0,we never feel anything for these characters and as a result the film is basically just a curiosity,0,0,0.9787234042553191,"['the film is so many that it wants to look like it ', 'the film is so many of its own in reality tv in which ', 'the film is a primer on its own animated tv and rather ', 'the film is a primer on its own animated tv in which ', 'the film is a primer on sentence of the film a movie ']","['it s a very tasteful rock and roll movie you could ', 'the film is so of those who try to look away from ', 'the film is a primer on the film s delicate little ', 'the film is so of those films try to be missing from ', 'the film is so of those who try to look at but it ']","{'tv': 0.1875, 'primer': 0.1875, 'many': 0.125, 'animated': 0.125, 'wants': 0.0625}","{'try': 0.2, 'look': 0.13333333333333333, 'tasteful': 0.06666666666666667, 'rock': 0.06666666666666667, 'roll': 0.06666666666666667}"
