23,from its invitingly upbeat oveure to its pathos filled but ultimately life affirming finale main is a masterfully conducted work,1,from its invitingly upbeat oveure to its pathos filled but ultimately life affirming finale main is a masterfully conducted work,0,0,0.9555555555555556,"['the film is a primer on its own animated tv in which ', 'the film is a primer on sentence of the film a movie ', 'the film is a primer on its own animated tv and rather ', 'the film is so of the 70s or film in which it s performance ', 'the film is a primer on its own hollywood director ']","['the film is a primer on its own it s a rewarding balance ', 'it s a very tasteful to look at the most were what ', 'the film is so many of its own in reality tv and his ', 'the film has a contrivance as aificial as the film ', 'the film is a primer on its own school comedy with ']","{'primer': 0.2857142857142857, 'animated': 0.14285714285714285, 'tv': 0.14285714285714285, 'sentence': 0.07142857142857142, 'rather': 0.07142857142857142}","{'primer': 0.15384615384615385, 'rewarding': 0.07692307692307693, 'balance': 0.07692307692307693, 'tasteful': 0.07692307692307693, 'look': 0.07692307692307693}",0.03028416633605957
24,an old fashioned drama of substance about a teacher s slide down the slippery slope of dishonesty after an encounter with the rich and the powerful who have nothing but disdain for viue,1,an old fashioned drama of substance about a teacher s slide down the slippery slope of dishonesty after an encounter with the rich and the powerful who have nothing but disdain for viue,1,1,0.9818181818181818,"['the film has a laundry cast of human business but ', 'the film has the perfect characters are not much of ', 'the film has a laundry cast of human comedy that it ', 'the film has the heavy handed of a house ambition ', 'the film has a laundry cast of human comedy is a fascinating ']","['the movie has been in years old but even with the ', 'the movie has been in this is that rare drama that ', 'the film has been a huge fan of west side story noir ', 'the film has been a huge fan of dickens in which is ']","{'laundry': 0.15, 'cast': 0.15, 'human': 0.15, 'comedy': 0.1, 'business': 0.05}","{'huge': 0.14285714285714285, 'fan': 0.14285714285714285, 'years': 0.07142857142857142, 'old': 0.07142857142857142, 'even': 0.07142857142857142}",0.022664546966552734
25,it wouldn t be my preferred way of spending 100 minutes or 7 00,0,it wouldn t be my preferred way of spending 100 minutes or 7 00,0,0,0.9772727272727273,"['it wouldn t be my preferred way of spending 100 minutes or 7 00', 'the film is a primer on sentence of the film a movie ', 'a movie that rare into a man who can not always in ', 'the film is a contrivance as aificial as the film ', 'the film is so of the 70s or film in which it s performance ']","['a movie that so lovingly and present the most of screen ', 'the film is so of the 70s it would be adequately emphasized ', 'a movie that one of the best examples of a page to ', 'the film is so many of its own in reality tv and his ', 'the film is so of the best films of the year with ']","{'preferred': 0.0625, 'way': 0.0625, 'spending': 0.0625, '100': 0.0625, 'minutes': 0.0625}","{'best': 0.11764705882352941, 'lovingly': 0.058823529411764705, 'present': 0.058823529411764705, 'screen': 0.058823529411764705, '70s': 0.058823529411764705}",0.03070998191833496
26,flawed but wohy look at life in u s relocation camps,1,flawed but wohy look at life in u s relocation camps,1,1,0.9777777777777777,"['the film is a primer on its own animated tv and in ', 'a movie that so of the best films like a confidence ', 'the film is a primer on its own in town with sensitivity ', 'the film is a primer on its own and director michael ', 'a movie that one of the best films of the year with ']","['a movie that rare into a man who can not always in ', 'a movie that one of the best films of the year the ', 'the film is a primer on its own hollywood director ']","{'primer': 0.17647058823529413, 'best': 0.11764705882352941, 'films': 0.11764705882352941, 'animated': 0.058823529411764705, 'tv': 0.058823529411764705}","{'rare': 0.1, 'man': 0.1, 'always': 0.1, 'one': 0.1, 'best': 0.1}",0.019750356674194336
27,mckay seems embarrassed by his own invention and tries to rush through the intermediary passages apparently hoping that the audience will not notice the glaring triteness of the plot device he has put in service,0,mckay seems embarrassed by his own invention and tries to rush through the intermediary passages apparently hoping that the audience will not notice the glaring triteness of the plot device he has put in service,0,0,0.9803921568627451,"['the movie has all the rules of attraction is told ', 'mckay seems embarrassed by his own invention and tries to rush through the intermediary passages apparently hoping that the audience will not notice the glaring triteness of the plot device he has put in service', 'the film has the perfect characters are not to give ', 'the film has the perfect characters are not to compromise ', 'the movie has been in years old but director michael ']","['the film has the number of s a similarly morose and ', 'the film has the perfect of s best films the characters ', 'the film has a laundry list of movie largely for the ', 'the film has the perfect of s best and the characters ', 'the film has an infectious enthusiasm and it s so ']","{'perfect': 0.06451612903225806, 'characters': 0.06451612903225806, 'rules': 0.03225806451612903, 'attraction': 0.03225806451612903, 'told': 0.03225806451612903}","{'perfect': 0.13333333333333333, 'best': 0.13333333333333333, 'characters': 0.13333333333333333, 'number': 0.06666666666666667, 'similarly': 0.06666666666666667}",0.030886173248291016
28,director andrew niccol demonstrates a wry understanding of the quirks of fame his healthy sense of satire is light and fun,1,director andrew niccol demonstrates a wry understanding of the quirks of fame his healthy sense of satire is light and fun,1,1,0.9767441860465116,"['the film is a primer on its own director director ', 'the film is a primer on the beach with humor and humor ', 'the film is a primer on its own animated tv and in ', 'the film is so of those films try to be missing from ', 'the film is so of those who try to look away from ']","['the film is so many of its own in reality tv in which ', 'the film is a primer on sentence of the film a movie ', 'the film is a primer on its own hollywood director ', 'the film is too many out of these or historical moments ', 'the film is so many of the time it s so bad that it ']","{'primer': 0.1875, 'director': 0.125, 'humor': 0.125, 'try': 0.125, 'beach': 0.0625}","{'many': 0.21428571428571427, 'primer': 0.14285714285714285, 'reality': 0.07142857142857142, 'tv': 0.07142857142857142, 'sentence': 0.07142857142857142}",0.022644758224487305
29,as pure over the top trash any john waters movie has it beat by a country mile,0,as pure over the top trash any john waters movie has it beat by a country mile,0,0,0.9285714285714286,"['the film is so many of its own in reality tv in which ', 'the film is a primer on its own hollywood director ', 'the film is so of the 70s or film in which it s performance ', 'the film is a primer on its own animated tv in which ', 'the film is a primer on sentence of the film a movie ']","['a movie that one of the best films of the year with ', 'the film is so many that you ll at least credit for ', 'the film is a primer on its own it s a of healthy ', 'the film is a primer on its own it fills a good movie ', 'the film is so many that it wants to look like it ']","{'primer': 0.23076923076923078, 'tv': 0.15384615384615385, 'many': 0.07692307692307693, 'reality': 0.07692307692307693, 'hollywood': 0.07692307692307693}","{'many': 0.125, 'primer': 0.125, 'one': 0.0625, 'best': 0.0625, 'films': 0.0625}",0.034208059310913086
30,rymer doesn t trust laughs and doesn t conjure proper respect for followers of the whole dead undead genre who deserve more from a vampire pic than a few shrieky special effects,0,rymer doesn t trust laughs and doesn t conjure proper respect for followers of the whole dead undead genre who deserve more from a vampire pic than a few shrieky special effects,0,0,0.9821428571428571,"['the movie has been readily dismissed as the pitch ', 'the film has the perfect characters are not to give ', 'the film has the perfect characters are not to lend ', 'the film has the perfect characters are too much but ', 'the film has been a huge fan of dickens in which is ']","['the film has a laundry cast of war guilt as it is ', 'the film has a laundry list of camera work in which ', 'the film has the perfect characters are not an intelligent ', 'the film has a laundry cast of human observation and ', 'the film is so of those who try to look away from ']","{'perfect': 0.2, 'characters': 0.2, 'readily': 0.06666666666666667, 'dismissed': 0.06666666666666667, 'pitch': 0.06666666666666667}","{'laundry': 0.16666666666666666, 'cast': 0.1111111111111111, 'war': 0.05555555555555555, 'guilt': 0.05555555555555555, 'list': 0.05555555555555555}",0.048079729080200195
31,when de palma s bad he s really bad and femme fatale ranks with the worst he has done,0,when de palma s bad he s really bad and femme fatale ranks with the worst he has done,0,0,1.0,"['the film is too many out of these or historical moments ', 'the film is a contrivance as aificial as the movie ', 'the film is so many that its through the film s mid ', 'the film is so many of the time it s so bad that it ', 'the film is too many or even through the movie s of ']","['the film is a primer on the beach with humor and american ', 'the film is a primer on its own and director michael ', 'the film is a primer on its own director director ', 'the film is a primer on the beach with humor and humor ', 'the film is so many of its own in reality filmmaking ']","{'many': 0.3333333333333333, 'historical': 0.08333333333333333, 'moments': 0.08333333333333333, 'contrivance': 0.08333333333333333, 'aificial': 0.08333333333333333}","{'primer': 0.23529411764705882, 'humor': 0.17647058823529413, 'director': 0.17647058823529413, 'beach': 0.11764705882352941, 'american': 0.058823529411764705}",0.02780437469482422
32,has its moments and almost as many subplots,0,has its moments and almost as many subplots,1,1,0.9594594594594594,"['a movie that rare into a movie that is a little more ', 'the film s so uninspiring that covers a lot of the ', 'the film is so of the 70s it would be adequately emphasized ', 'a movie that one would be an intelligent and a movie ', 'a fascinating and ultimately tale that it s hard to ']","['a movie that one would have been seen in advance or ', 'a movie that rare into a man who can not always in ', 'a movie that rare film about every to u s manic in ', 'a movie that so of the energy in a of healthy tv s ']","{'would': 0.125, 'rare': 0.0625, 'little': 0.0625, 'uninspiring': 0.0625, 'covers': 0.0625}","{'rare': 0.14285714285714285, 'one': 0.07142857142857142, 'would': 0.07142857142857142, 'seen': 0.07142857142857142, 'advance': 0.07142857142857142}",0.02769327163696289
33,sewer rats could watch this movie and be so skeeved out that they d need a shower,0,sewer rats could watch this movie and be so skeeved out that they d need a shower,0,0,0.9302325581395349,"['the film is a primer on sentence of the film a movie ', 'the film is a primer on its own animated tv in which ', 'it s a very tasteful to look at the most were what ', 'the film is so many of its own in reality tv and so ', 'the film is so of the 70s or film in which it s performance ']","['the film is a primer on its own it fills a strong ', 'a movie that so of the best films like a confidence ', 'the film s a gaudy work of human observation footage ', 'it s a very tasteful rock and roll movie you could ', 'the film is a primer on its own it s a of healthy ']","{'primer': 0.16666666666666666, 'tv': 0.16666666666666666, 'sentence': 0.08333333333333333, 'animated': 0.08333333333333333, 'tasteful': 0.08333333333333333}","{'primer': 0.1111111111111111, 'fills': 0.05555555555555555, 'strong': 0.05555555555555555, 'best': 0.05555555555555555, 'films': 0.05555555555555555}",0.030784130096435547
34,directed without the expected flair or imagination by hong kong master john woo windtalkers airs just about every cliche in the war movie compendium across its indulgent two hour and fifteen minute length,0,directed without the expected flair or imagination by hong kong master john woo windtalkers airs just about every cliche in the war movie compendium across its indulgent two hour and fifteen minute length,0,0,0.9818181818181818,"['the film is a contrivance as aificial as the movie ', 'the film has been a huge that the movie is one of ', 'the film has been a huge fan of dickens in their underwritten ', 'the film has the perfect characters are too much but ', 'the film has the perfect characters are not to compromise ']","['the film has a laundry cast of human shocomings but ', 'the film has an infectious enthusiasm and the movie ', 'the film has been a huge fan of dickens in his actors ', 'the film has a laundry list of movie largely for the ', 'the film has a laundry cast of human observation are ']","{'huge': 0.14285714285714285, 'perfect': 0.14285714285714285, 'characters': 0.14285714285714285, 'contrivance': 0.07142857142857142, 'aificial': 0.07142857142857142}","{'laundry': 0.17647058823529413, 'cast': 0.11764705882352941, 'human': 0.11764705882352941, 'shocomings': 0.058823529411764705, 'infectious': 0.058823529411764705}",0.04234671592712402
35,an alternately raucous and sappy ethnic sitcom you d be wise to send your regrets,0,an alternately raucous and sappy ethnic sitcom you d be wise to send your regrets,1,1,0.95,"['the film is a primer on its own it fills a good movie ', 'the film is so of the best films of the year with ', 'the film is a primer on its own and director in years ', 'a movie that so lovingly and present the one of screen ', 'the film is a primer on its own it s a of above the ']","['a movie that rare into a man who can t seen it s not ', 'the film is so of the 70s or film in which it s performance ', 'the film is a primer on sentence of the film a movie ', 'the film is so many that its through the film s mid ']","{'primer': 0.21428571428571427, 'fills': 0.07142857142857142, 'good': 0.07142857142857142, 'best': 0.07142857142857142, 'films': 0.07142857142857142}","{'rare': 0.1111111111111111, 'man': 0.1111111111111111, 'seen': 0.1111111111111111, '70s': 0.1111111111111111, 'performance': 0.1111111111111111}",0.018054485321044922
36,the best thing that can be said of the picture is that it does have a few cute moments,0,the best thing that can be said of the picture is that it does have a few cute moments,1,1,0.9545454545454546,"['the film is so of those films which there are moments ', 'the film is a primer on the rules of attraction and ', 'the film is so many of its own in reality filmmaking ', 'the film is a primer on its own it s a of healthy ', 'the film is so of those who try to look away from ']","['the film is too many or sugary through to think that ', 'the film is a primer on its own animated tv in which ', 'the film is too many or even through the movie s of ']","{'primer': 0.15384615384615385, 'films': 0.07692307692307693, 'moments': 0.07692307692307693, 'rules': 0.07692307692307693, 'attraction': 0.07692307692307693}","{'many': 0.25, 'sugary': 0.125, 'think': 0.125, 'primer': 0.125, 'animated': 0.125}",0.019475936889648438
37,jones helps breathe some life into the insubstantial plot but even he is overwhelmed by predictability,0,jones helps breathe some life into the insubstantial plot but even he is overwhelmed by predictability,1,1,0.9782608695652174,"['the film is a primer on its own it s a rewarding balance ', 'the film is a primer on its own and director michael ', 'the film is a primer on its own animated tv and in ', 'the film has a number of themes a complex on that ', 'the film is so consistently that the impoance of human ']","['the film is a primer on its own animated tv in which ', 'the film is too many or even through the movie s mid ', 'the film is so of the 70s or film in which it s performance ']","{'primer': 0.2, 'rewarding': 0.06666666666666667, 'balance': 0.06666666666666667, 'director': 0.06666666666666667, 'michael': 0.06666666666666667}","{'primer': 0.125, 'animated': 0.125, 'tv': 0.125, 'many': 0.125, 'even': 0.125}",0.0195467472076416
38,anyone who suffers through this film deserves at the very least a big box of consolation candy,0,anyone who suffers through this film deserves at the very least a big box of consolation candy,1,1,0.9555555555555556,"['the film is a primer on its own and director in its ', 'the film is a primer on its own it s a of healthy ', 'the film is a primer on its own director director ', 'the film is a primer on its own it s a rewarding balance ', 'it s a very tasteful to look at the most were what ']","['the film is so many of its own in reality tv in which ', 'the film is a primer on its own animated tv and rather ', 'the film is a contrivance as aificial as the film ']","{'primer': 0.3333333333333333, 'director': 0.25, 'healthy': 0.08333333333333333, 'rewarding': 0.08333333333333333, 'balance': 0.08333333333333333}","{'tv': 0.2222222222222222, 'many': 0.1111111111111111, 'reality': 0.1111111111111111, 'primer': 0.1111111111111111, 'animated': 0.1111111111111111}",0.021868467330932617
39,moderately involving despite bargain basement photography and hackneyed romance,0,moderately involving despite bargain basement photography and hackneyed romance,0,0,0.9761904761904762,"['the film s so predictable and just plain detailed ', 'the film s so uninspiring that could a gorgeously ', 'the film is a primer on its own his director and feels ', 'a movie that rare film about every to u s manic in ', 'the film s so uninspiring that could a giant enterprise ']","['the film s a gaudy bag of a icon that s complexity ', 'the film is a searing album of s most of a diesel ', 'the film s a gaudy bag of a icon that s career <end> ', 'the film s so uninspiring that covers a lot of the ', 'the film is a primer on its own in town with action ']","{'uninspiring': 0.11764705882352941, 'could': 0.11764705882352941, 'predictable': 0.058823529411764705, 'plain': 0.058823529411764705, 'detailed': 0.058823529411764705}","{'gaudy': 0.11764705882352941, 'bag': 0.11764705882352941, 'icon': 0.11764705882352941, 'complexity': 0.058823529411764705, 'searing': 0.058823529411764705}",0.08997488021850586
40,it recycles every clich about gays in what is essentially an extended soap opera,0,it recycles every clich about gays in what is essentially an extended soap opera,0,0,1.0,"['the film is a primer on its own it feels like a lot ', 'the film is a primer on sentence of the film a movie ', 'the film is so of the 70s or film in which it s performance ', 'the film is a primer on its own animated tv and rather ', 'the film is so many of its own in reality tv in which ']","['the film is a primer on its own it fills a film above ', 'the film is so many of its own in reality tv and his ', 'the film has a number of themes a complex on a good ', 'the film is a primer on its own animated tv and in ', 'the film is so many of its own in reality movies that ']","{'primer': 0.2, 'tv': 0.13333333333333333, 'feels': 0.06666666666666667, 'like': 0.06666666666666667, 'lot': 0.06666666666666667}","{'primer': 0.13333333333333333, 'many': 0.13333333333333333, 'reality': 0.13333333333333333, 'tv': 0.13333333333333333, 'fills': 0.06666666666666667}",0.02699112892150879
41,hilarious acidic brit comedy,1,hilarious acidic brit comedy,0,0,0.9769230769230769,"['the film s blatant is so predictable and its surprising ', 'the movie is a mediocre movie flick about a <end> ', 'a movie that will be a of a movie ultimately devoid ', 'the film s what is so of and all too many <end> ', 'a movie that tries to the usual woods but winds up ']","['the film s blatant is so good and ultimately hope ', 'a movie that tries to the silence of the field of ', 'the film s a gaudy bag of a icon that feels <end> ', 'the film is a primer on its own and director director ', 'the film is a solid action thriller that is a pleasant ']","{'blatant': 0.08333333333333333, 'predictable': 0.08333333333333333, 'surprising': 0.08333333333333333, 'mediocre': 0.08333333333333333, 'flick': 0.08333333333333333}","{'director': 0.1111111111111111, 'blatant': 0.05555555555555555, 'good': 0.05555555555555555, 'ultimately': 0.05555555555555555, 'hope': 0.05555555555555555}",0.17691874504089355
42,sade is an engaging look at the controversial eponymous and fiercely atheistic hero,1,sade is an engaging look at the controversial eponymous and fiercely atheistic hero,1,1,1.0,"['the film is a primer on its own it fills a strong ', 'the film is a primer on its own animated tv and in ', 'the film is a primer on its own in town with sensitivity ', 'a movie that one of the best films of the situation ', 'the film has a number of themes a complex on a good ']","['the film is a primer on its own and fills its characters ', 'a movie that rare into a man who can not always in ', 'the film is so many that its through the film s mid ']","{'primer': 0.17647058823529413, 'fills': 0.058823529411764705, 'strong': 0.058823529411764705, 'animated': 0.058823529411764705, 'tv': 0.058823529411764705}","{'primer': 0.125, 'fills': 0.125, 'characters': 0.125, 'rare': 0.125, 'man': 0.125}",0.021892786026000977
43,flashy gadgets and whirling fight sequences may look cool but they can t distract from the flawed suppo structure holding equilibrium up,0,flashy gadgets and whirling fight sequences may look cool but they can t distract from the flawed suppo structure holding equilibrium up,1,1,1.0,"['the film is so of those films try to be missing it ', 'the film has a laundry exercise in camera with and ', 'the film is a primer on its own and director michael ', 'the film is so of the 70s it would be adequately emphasized ', 'the film is a primer on its own school comedy with ']","['the film has a contrivance as aificial as the exalted ', 'the film is so consistently unimaginative that doesn ', 'the film is so many of the time it s so bad that it ']","{'primer': 0.125, 'films': 0.0625, 'try': 0.0625, 'missing': 0.0625, 'laundry': 0.0625}","{'contrivance': 0.125, 'aificial': 0.125, 'exalted': 0.125, 'consistently': 0.125, 'unimaginative': 0.125}",0.01915717124938965
44,the audience when i saw this one was chuckling at all the wrong times and that s a bad sign when they re supposed to be having a collective hea attack,0,the audience when i saw this one was chuckling at all the wrong times and that s a bad sign when they re supposed to be having a collective hea attack,0,0,0.9629629629629629,"['the film has the perfect characters are not to lend ', 'the film is so many of the time it s so bad that it ', 'the film has been in years old but director s a bad ', 'the film has been a huge fan of dickens in their underwritten ', 'the film has the perfect characters are too much but ']","['the film has an infectious enthusiasm and it doesn ', 'the film is so of those who try to look away from ', 'the film has a laundry cast of war observation moments ', 'the film has a laundry exercise in camera and that ', 'the film has been a huge fan of human with such life ']","{'perfect': 0.11764705882352941, 'characters': 0.11764705882352941, 'bad': 0.11764705882352941, 'lend': 0.058823529411764705, 'many': 0.058823529411764705}","{'laundry': 0.11764705882352941, 'infectious': 0.058823529411764705, 'enthusiasm': 0.058823529411764705, 'try': 0.058823529411764705, 'look': 0.058823529411764705}",0.038598060607910156
45,in the spirit of the season i assign one bright shining star to robeo benigni s pinocchio but i guarantee that no wise men will be following after it,0,in the spirit of the season i assign one bright shining star to robeo benigni s pinocchio but i guarantee that no wise men will be following after it,0,0,0.9534883720930233,"['the film is so many of the time it s so bad that s ', 'the film has the perfect characters are too many of ', 'the film has the perfect characters are not to give ', 'the film is too many out of these or historical moments ', 'the film is too many or even putting the outdated ']","['the film is a primer on the beach with humor and american ', 'the film is so of those who try to look away from ', 'the film is a primer on its own director director ', 'the film has an infectious enthusiasm and we re touched ', 'the film is so of those films try to be missing from ']","{'many': 0.25, 'perfect': 0.125, 'characters': 0.125, 'time': 0.0625, 'bad': 0.0625}","{'primer': 0.125, 'try': 0.125, 'director': 0.125, 'beach': 0.0625, 'humor': 0.0625}",0.025482177734375
46,escapism in its purest form,1,escapism in its purest form,1,1,0.9791666666666666,"['the film is a primer on its own his director director ', 'the film is a primer on its own and director in america ', 'a movie that so lovingly and present the one of screen ', 'the film s a gaudy bag of a icon that s career <end> ', 'the film is a primer on its own and director in his ']","['the film is a primer on its beach with great way or ', 'a movie that rare into a man who can t seen it s not ', 'a film that one would have been in the whole movie ']","{'director': 0.25, 'primer': 0.1875, 'america': 0.0625, 'lovingly': 0.0625, 'present': 0.0625}","{'primer': 0.1, 'beach': 0.1, 'great': 0.1, 'way': 0.1, 'rare': 0.1}",0.024798870086669922
