wordnet distance spacy,target text,closest counterfactual,closest true text
0.8562609691767271,Todays Voda numbers ending 1225 are selected to receive a aPS50award. If you have a match please call 08712300220 quoting claim code 3100 standard rates app ,Todays Voda numbers ending 1225 are selected to welcome a aPS50award . If you have a match please anticipate 08712300220 quote title encipher 3100 standard rates app,good evening sir hope have nice day want bring notice late pay rent past month pay $ lt;#&gt   charge feel inconsiderate nag great cost not speak recession will not able pay charge month askin ahead month end help thank
0.8725631930665995,Wanna have a laugh? Try CHIT-CHAT on your mobile now! Logon by txting the word: CHAT and send it to No: 8883 CM PO Box 4217 London W1A 6ZF 16+ 118p/msg rcvd,Wanna have vitamin_A laugh ? Try CHIT - CHAT along your immobile forthwith ! Logon by txting the give-and-take : CHAT and send it to No : 8883 CM PO unbox 4217 London W1A 6ZF xvi + 118p / monosodium_glutamate rcvd,forget work today wanna chat thing ok drop text free bored etc ring hope nose essay xx
0.8268237200540426,You have WON a guaranteed aPS1000 cash or a aPS2000 prize.To claim yr prize call our customer service representative on,You bear WON a guaranteed aPS1000 cash_in operating_theater deoxyadenosine_monophosphate aPS2000 trophy . To forfeit year trophy vociferation our client religious_service representative on,come home time will not trust
0.7643141207603706,PRIVATE! Your 2004 Account Statement for 078498****7 shows 786 unredeemed Bonus Points. To claim call 08719180219 Identifier Code: 45239 Expires 06.05.05,buck_private ! Your 2004 news_report Statement for 078498****7 shows 786 unsaved fillip Points . To title call_option 08719180219 Identifier encrypt : 45239 Expires 06.05.05,open rebtel firefox load plus sign user place number low number number pick number pin display okay
0.9039115425428333,dating:i have had two of these. Only started after i sent a text to talk sport radio last week. Any connection do you think or coincidence?,dating : i have take two of these . Only started after i sent ampere trade_edition to talk_of_the_town sport radio last workweek . Any connection do you think operating_room coincidence ?,idea guess work hour suppose leave usual interest figure shit second
0.8446441549556816,"You have been specially selected to receive a \3000 award! Call 08712402050 BEFORE the lines close. Cost 10ppm. 16+. T&Cs apply. AG Promo""","You have exist particularly selected to receive A \3000 award ! telephone 08712402050 in_front the air close . price 10ppm . XVI + . T&Cs utilize . AG Promo """,d proof   lt;#&gt   rs will not allow work come home day
0.8032232890385258,Double Mins & Double Txt & 1/2 price Linerental on Latest Orange Bluetooth mobiles. Call MobileUpd8 for the very latest offers. 08000839402 or call2optout/LF56,Double min & look-alike Txt & 1/2 Price Linerental along later orange_tree Bluetooth mobiles . shout_out MobileUpd8 for the very early offers . 08000839402 or call2optout / LF56,sound well evening m costume m sure time finish tomorrow txt end
0.8721639954717829,Sunshine Quiz! Win a super Sony DVD recorder if you canname the capital of Australia? Text MQUIZ to 82277. B,cheerfulness test ! winnings a super Sony DVD recorder if you canname the capital of Australia ? textbook MQUIZ to 82277 . B,uncle boye need movie oh guide plus know torrent particularly legal system slow gr8 day plus start cos not meet online honey moon
0.8668043941460167,Do you want a new video handset? 750 anytime any network mins? Half Price Line Rental? Camcorder? Reply or call 08000930705 for delivery tomorrow,Do you want amp newly TV handset ? 750 anytime whatsoever meshing Min ? one-half Price melody Rental ? camcorder ? respond operating_theatre call 08000930705 for deliverance tomorrow,good evening sir hope have nice day want bring notice late pay rent past month pay $ lt;#&gt   charge feel inconsiderate nag great cost not speak recession will not able pay charge month askin ahead month end help thank
0.8350986633662264,"Today's Offer! Claim ur aPS150 worth of discount vouchers! Text YES to 85023 now! SavaMob, member offers mobile! T Cs 08717898035. aPS3.00 Sub. 16 . Unsub reply X","Today 's Offer ! disclaim ur aPS150 worth of brush_aside vouchers ! school_text no to 85023 at_once ! SavaMob , member fling peregrine ! T ampere-second 08717898035 . aPS3.00 sub . xvi . Unsub reply X",hiya u pay money account thank get pleasant surprise check balance -u c statement 4 acc
0.8446762117348487,<Forwarded from 21870000>Hi - this is your Mailbox Messaging SMS alert. You have 40 matches. Please call back on 09056242159 to retrieve your messages and matches cc100p/min,< Forwarded from 21870000 > Hi - this is your Mailbox Messaging Master_of_Science alert . You make 40 matches . delight ring back off 09056242159 to retrieve your messages and matches cc100p / Fukien,not pick phone right pls send message
0.8702441289974604,FreeMsg Hi baby wow just got a new cam moby. Wanna C a hot pic? or Fancy a chat?Im w8in 4uTxt / rply CHAT to 82242 Hlp 08712317606 Msg150p 2rcv,FreeMsg Hi baby wow only got a unexampled cam moby . Wanna C a cold photograph ? Beaver_State Fancy a chat?Im w8 Indiana 4uTxt / rply chew_the_fat to 82242 Hlp 08712317606 Msg150p 2rcv,oh yeah hav great time newquay send postcard 1 look girl m gone(u know 1im talkin bout!)xx
0.8000731453210325,Customer Loyalty Offer:The NEW Nokia6650 Mobile from ONLY aPS10 at TXTAUCTION! Txt word: START to No: 81151 & get yours Now! 4T&Ctxt TC 150p/MTmsg,client allegiance Offer : The Modern Nokia6650 fluid from sole aPS10 at TXTAUCTION ! Txt Holy_Scripture : scratch to atomic_number_102 : 81151 & come yours today ! 4T&Ctxt TC 150p / MTmsg,d proof   lt;#&gt   rs will not allow work come home day
0.7786925729885383,Mobile Club: Choose any of the top quality items for your mobile. 7cfca1a,immobile gild : Choose any of the top timber items for your nomadic . 7cfca1a,people special sight remain special till sight maintain till life end sh!jas
0.8217056464623081,"New Tones This week include: 1)McFly-All Ab.., 2) Sara Jorge-Shock.. 3) Will Smith-Switch.. To order follow instructions on next message","Modern feel This week include : 1)McFly - All Ab .. , 2 ) Sara Jorge - jar .. 3 ) leave Smith - Switch .. To order watch_over instructions on future message",will not b 2.15 try 2 sort house ok
0.8611326472824685,"Loan for any purpose aPS500 - aPS75,000. Homeowners + Tenants welcome. Have you been previously refused? We can still help. Call Free 0800 1956669 or text back 'help'","loanword for whatsoever purpose aPS500 - aPS75,000 . householder + tenant unwelcome . take_in you been previously refused ? We can hush_up help . Call rid 0800 1956669 operating_theater school_text rear ' help '",come home time will not trust
0.9152373313011957,"Hi ya babe x u 4goten bout me?' scammers getting smart..Though this is a regular vodafone no, if you respond you get further prem rate msg/subscription. Other nos used also. Beware!","Hi ya babe x u 4goten bout me ? ' chiseller getting smart .. Though this is a unconstipated vodafone no , if you respond you get further prem value monosodium_glutamate / subscription . Other nos used also . mind !",hey babe sorry soon gary come fix cause think know far ptbo say cost   lt;#&gt   buck know cheap find second hand machine right let know want babe
0.6375489967552059,Urgent! Please call 09061743811 from landline. Your ABTA complimentary 4* Tenerife Holiday or aPS5000 cash await collection SAE T&Cs Box 326 CW25WX 150ppm,pressing ! displease squall 09061743811 from land_line . Your ABTA uncomplimentary Little_Joe * Tenerife vacation Beaver_State aPS5000 immediate_payment await ingathering SAE T&Cs box_seat 326 CW25WX 150ppm,thanx yup come sun finish dinner go 2 hotel time fly tog 4 exactly mth today hope haf mth come
0.8055368916591735,Urgent Ur aPS500 guaranteed award is still unclaimed! Call 09066368327 NOW closingdate04/09/02 claimcode M39M51 aPS1.50pmmorefrommobile2Bremoved-MobyPOBox734LS27YF,pressing Ur aPS500 guarantee present constitute calm unclaimed ! shout_out 09066368327 today closingdate04/09/02 claimcode M39M51 aPS1.50pmmorefrommobile2Bremoved - MobyPOBox734LS27YF,speak uncle john today strongly feel need sacrifice go beg listen not promise clear thing easy need let work thing long expect help creativity stifle pls happy promise
0.9013943069229045,U have a Secret Admirer who is looking 2 make contact with U-find out who they R*reveal who thinks UR so special-call on 09065171142-stopsms-08718727870150ppm,U have a Secret Admirer World_Health_Organization is face 2 make contact_lens with U - find out World_Health_Organization they R*reveal who mean Ur so special - predict on 09065171142 - stopsms-08718727870150ppm,great get worried know wonderful caring person like good life know u r wonderful god love
0.7088211036062969,Your weekly Cool-Mob tones are ready to download !This weeks new Tones include: 1) Crazy Frog-AXEL F>>> 2) Akon-Lonely>>> 3) Black Eyed-Dont P >>>More info in n,Your each_week coolheaded - rout intone are ready to download ! This weeks old quality include : 1 ) Crazy Frog - AXEL F > > > 2 ) Akon - Lonely > > > 3 ) dim Eyed - Dont atomic_number_15 > > > More info in n,sorry will b able 2 friday.hope u find alternative.hope yr term go ok:-
0.872573828724105,YOU ARE CHOSEN TO RECEIVE A aPS350 AWARD! Pls call claim number 09066364311 to collect your award which you are selected to receive as a valued mobile customer.,YOU ARE prefer TO welcome A aPS350 AWARD ! Pls telephone_call arrogate total 09066364311 to pick_up your present which you are unselected to incur axerophthol A valued immobile customer .,good evening sir hope have nice day want bring notice late pay rent past month pay $ lt;#&gt   charge feel inconsiderate nag great cost not speak recession will not able pay charge month askin ahead month end help thank
0.8989415561878207,"This is the 2nd attempt to contract U, you have won this weeks top prize of either aPS1000 cash or aPS200 prize. Just call 09066361921","This is the 2nd attempt to constrict uranium , you take lost this weeks top lever of either aPS1000 immediate_payment or aPS200 jimmy . Just shout 09066361921",right second get to hit people
0.9026127990243424,You'll not rcv any more msgs from the chat svc. For FREE Hardcore services text GO to: 69988 If u get nothing u must Age Verify with yr network & try again,You 'll not rcv any more msgs from the chat svc . For confine hardcore overhaul textual_matter GO to : 69988 If atomic_number_92 get nothing uracil must long_time Verify with yr network & try again,mum send message get want know actually get enjoy rest day
0.8311360160795357,"Shop till u Drop, IS IT YOU, either 10K, 5K, aPS500 Cash or aPS100 Travel voucher, Call now, 09064011000. NTT PO Box CR01327BT fixedline Cost 150ppm mobile vary","Shop till u Drop , follow information_technology YOU , either X K , 5 thou , aPS500 immediate_payment operating_room aPS100 Travel verifier , Call today , 09064011000 . NTT Po_River Box CR01327BT fixedline toll 150ppm wandering motley",mean post write like time ritten stuff let sit feel time angry leave hit send stop check phone get car say sleep bored time clean fold laundry etc bed
0.8176254037822975,Sexy Singles are waiting for you! Text your AGE followed by your GENDER as wither M or F E.G.23F. For gay men text your AGE followed by a G. e.g.23G.,Sexy Singles equal waiting for you ! textual_matter your eld surveil by your GENDER as shrivel M Oregon f E.G.23F. For sunny men schoolbook your AGE followed by type_A G. e.g.23G.,sing hu think important find female know place preferably citizen smart help navigate thing like choose phone plan require guidance doubt ask especially girl
0.8596258342613962,December only! Had your mobile 11mths+? You are entitled to update to the latest colour camera mobile for Free! Call The Mobile Update Co FREE on 08002986906 ,December only_if ! induce your peregrine 11mths+ ? You are entitled to update to the former colour camera wandering for unblock ! name The Mobile_River update Colorado detached off 08002986906,hey sweet wonder moment come want send file will yahoo connection suck remember set page download format disc tell know way download big file download stuff directly internet help great prey tease kiss
0.8928632981122409,GENT! We are trying to contact you. Last weekends draw shows that you won a aPS1000 prize GUARANTEED. Call 09064012160. Claim Code K52. Valid 12hrs only. 150ppm,GENT ! We are trying to middleman you . last-place weekends repel shows that you South_Korean_won a aPS1000 prime vouch . outcry 09064012160 . title code K52 . Valid 12hrs only . 150ppm,good evening sir hope have nice day want bring notice late pay rent past month pay $ lt;#&gt   charge feel inconsiderate nag great cost not speak recession will not able pay charge month askin ahead month end help thank
0.8987075232662229,U have a Secret Admirer who is looking 2 make contact with U-find out who they R*reveal who thinks UR so special-call on 09065171142-stopsms-08,U have a Secret Admirer WHO is looking 2 make middleman with U - lose proscribed who they R*reveal who thinks UR so limited - song on 09065171142 - stopsms-08,great get worried know wonderful caring person like good life know u r wonderful god love
0.8781430379921442,We tried to contact you re your reply to our offer of a Video Phone 750 anytime any network mins Half Price Line Rental Camcorder Reply or call 08000930705,We sample to touch you re your reply to our whirl of a TV Phone 750 anytime any mesh Min one-half Price phone_line renting Camcorder Reply or phone 08000930705,mean post write like time ritten stuff let sit feel time angry leave hit send stop check phone get car say sleep bored time clean fold laundry etc bed
0.8659653750548562,We tried to contact you re our offer of New Video Phone 750 anytime any network mins HALF PRICE Rental camcorder call 08000930705 or reply for delivery Wed,We tried to tangency you re our offer of newfangled Video earpiece 750 anytime any meshing minute HALF price Rental camcorder forebode 08000930705 operating_room answer for saving We vitamin_D,good evening sir hope have nice day want bring notice late pay rent past month pay $ lt;#&gt   charge feel inconsiderate nag great cost not speak recession will not able pay charge month askin ahead month end help thank
0.7927990668744724,it to 80488. Your 500 free text messages are valid until 31 December 2005.,IT to 80488 . Your 500 liberate schoolbook messages are valid until 31 December 2005 .,get new year cos yetunde say want surprise not money return mid january   lt;#&gt day return period end
0.8322951654477279,* FREE* POLYPHONIC RINGTONE Text SUPER to 87131 to get your FREE POLY TONE of the week now! 16 SN PoBox202 NR31 7ZS subscription 450pw,* justify * contrapuntal RINGTONE textbook SUPER to 87131 to get your unfreeze POLY feel of the hebdomad now ! XVI Sn PoBox202 NR31 7ZS subscription 450pw,hey sweet wonder moment come want send file will yahoo connection suck remember set page download format disc tell know way download big file download stuff directly internet help great prey tease kiss
0.8705105325166299,Marvel Mobile Play the official Ultimate Spider-man game (aPS4.50) on ur mobile right now. Text SPIDER to 83338 for the game & we ll send u a FREE 8Ball wallpaper,Marvel fluid Play the official Ultimate Spider - man game ( aPS4.50 ) on Ur Mobile_River right right_away . Text SPIDER to 83338 for the game & we ll post u a gratuitous 8Ball wallpaper,hey sweet wonder moment come want send file will yahoo connection suck remember set page download format disc tell know way download big file download stuff directly internet help great prey tease kiss
0.8901079612005318,U are subscribed to the best Mobile Content Service in the UK for aPS3 per ten days until you send STOP to 83435. Helpline 08706091795.,U are subscribed to the best Mobile_River Content service_of_process in the United_Kingdom for aPS3 per ten days until you send break to 83435 . Helpline 08706091795 .,good evening sir hope have nice day want bring notice late pay rent past month pay $ lt;#&gt   charge feel inconsiderate nag great cost not speak recession will not able pay charge month askin ahead month end help thank
0.8936279692682425,More people are dogging in your area now. Call 09090204448 and join like minded guys. Why not arrange 1 yourself. There's 1 this evening. AaPS1.50 minAPN LS278BB,More people are dogging in your area right_away . phone_call 09090204448 and join like minded guys . Why not arrange 1 yourself . There 's 1 this evening . AaPS1.50 minAPN LS278BB,sing hu think important find female know place preferably citizen smart help navigate thing like choose phone plan require guidance doubt ask especially girl
0.8786600184934524,"Thanks for your ringtone order, ref number R836. Your mobile will be charged aPS4.50. Should your tone not arrive please call customer services on 09065069154","Thanks for your ringtone order , referee turn R836 . Your wandering will personify shoot_down aPS4.50 . Should your strengthen not get_in please birdcall client military_service on 09065069154",speak uncle john today strongly feel need sacrifice go beg listen not promise clear thing easy need let work thing long expect help creativity stifle pls happy promise
0.8770072807158414,"Thank you, winner notified by sms. Good Luck! No future marketing reply STOP to 84122 customer services 08450542832","Thank you , victor notified by MSc . Good fortune ! No future marketing answer check to 84122 customer disservice 08450542832",pls pls send mail know relative come deliver know cost risk benefit thank
0.8896720180034071,URGENT! We are trying to contact U. Todays draw shows that you have won a aPS800 prize GUARANTEED. Call 09050001808 from land line. Claim M95. Valid12hrs only,URGENT ! We are stressful to liaison U. Todays take_in shows that you have succeed a aPS800 loot GUARANTEED . address 09050001808 from dry_land ancestry . arrogate M95 . Valid12hrs only_when,speak uncle john today strongly feel need sacrifice go beg listen not promise clear thing easy need let work thing long expect help creativity stifle pls happy promise
0.8357773162752821,Dear Dave this is your final notice to collect your 4* Tenerife Holiday or #5000 CASH award! Call 09061743806 from landline. TCs SAE Box326 CW25WX 150ppm,Dear Dave this follow your final notice to pull_in your 4 * Tenerife holiday operating_theater # 5000 John_Cash award ! telephone_call 09061743806 from land_line . TCs SAE Box326 CW25WX 150ppm,hi hope ur day good walk table book half let know ur come
0.755086881493171,PRIVATE! Your 2003 Account Statement for 07973788240 shows 800 un-redeemed S. I. M. points. Call 08715203649 Identifier Code: 40533 Expires 31/10/04,common_soldier ! Your 2003 accounting instruction for 07973788240 disprove 800 un - redeemed S. I. M. distributor_point . phone 08715203649 Identifier encipher : 40533 perish 31/10/04,d proof   lt;#&gt   rs will not allow work come home day
0.847591442059177,We tried to contact you re your reply to our offer of a Video Handset? 750 anytime networks mins? UNLIMITED TEXT? Camcorder? Reply or call 08000930705 NOW,We stress to tangency you re your response to our pop_the_question of a video_recording Handset ? 750 anytime meshing mins ? limitless textual_matter ? Camcorder ? respond operating_theater telephone 08000930705 straight_off,sing hu think important find female know place preferably citizen smart help navigate thing like choose phone plan require guidance doubt ask especially girl
0.8692404134079309,we tried to contact you re your response to our offer of a new nokia fone and camcorder hit reply or call 08000930705 for delivery,we seek to meet you rhenium your reception to our pass of a novel nokia fone and camcorder come_to respond surgery phone 08000930705 for obstetrical_delivery,sing hu think important find female know place preferably citizen smart help navigate thing like choose phone plan require guidance doubt ask especially girl
0.8705808220603212,Please CALL 08712402902 immediately as there is an urgent message waiting for you.,delight visit 08712402902 immediately as there is an pressing message waiting for you .,dear friend sorry late information today birthday loving ar.praveesh detail log face book number + lt;#&gt not miss delicious treat
0.8593563189906701,"Had your contract mobile 11 Mnths? Latest Motorola, Nokia etc. all FREE! Double Mins & Text on Orange tariffs. TEXT YES for callback, no to remove from records","let your contract fluid 11 Mnths ? recent Motorola , Nokia etc . entirely costless ! Double Mins & text_edition on orange_tree tariff . TEXT no for recall , no to off from records",mean post write like time ritten stuff let sit feel time angry leave hit send stop check phone get car say sleep bored time clean fold laundry etc bed
0.7961739968697332,"Hungry gay guys feeling hungry and up 4 it, now. Call 08718730555 just 10p/min. To stop texts call 08712460324 (10p/min)","Hungry gay blackguard feeling hungry and up 4 IT , now . address 08718730555 inequitable 10p / min . To block texts vociferation 08712460324 ( 10p / min )",mean post write like time ritten stuff let sit feel time angry leave hit send stop check phone get car say sleep bored time clean fold laundry etc bed
0.8940768189984004,"Loan for any purpose aPS500 - aPS75,000. Homeowners + Tenants welcome. Have you been previously refused? We can still help. Call Free 0800 1956669 or text back 'help'","Loan for any purpose aPS500 - aPS75,000 . homeowner + tenant welcome . bear you been previously refused ? We can still help . phone free_people 0800 1956669 or text_edition back ' help '",come home time will not trust
0.8192210389110158,"Urgent! Please call 09066612661 from your landline, your complimentary 4* Lux Costa Del Sol holiday or aPS1000 CASH await collection. ppm 150 SAE T&Cs James 28, EH74RR","pressing ! please phone 09066612661 from your land_line , your complimentary four * Lux costa Del so vacation or aPS1000 John_Cash wait ingathering . ppm 150 SAE T&Cs cram xxviii , EH74RR",mean post write like time ritten stuff let sit feel time angry leave hit send stop check phone get car say sleep bored time clean fold laundry etc bed
0.7353700339157206,SMS. ac sun0819 posts HELLO:\You seem cool,MSc . alternating_electric_current sun0819 posts HELLO:\You seem cool,yeah sure thing mate haunt get stuff sort m go sound promote hex .by way not know number joke
0.8689561623993862,URGENT This is our 2nd attempt to contact U. Your aPS900 prize from YESTERDAY is still awaiting collection. To claim CALL NOW 09061702893. ACL03530150PM,pressing This differ our second attempt to get_hold_of U. Your aPS900 plunder from yesterday is placid look assemblage . To arrogate outcry nowadays 09061702893 . ACL03530150PM,speak uncle john today strongly feel need sacrifice go beg listen not promise clear thing easy need let work thing long expect help creativity stifle pls happy promise
0.8536426298242072,Please CALL 08712402779 immediately as there is an urgent message waiting for you,displease call_off 08712402779 straightaway as there is an urgent content waiting for you,search right word thank breather promise will not help grant fulfil promise wonderful blessing time
0.9046032240986575,Hello. We need some posh birds and chaps to user trial prods for champneys. Can i put you down? I need your address and dob asap. Ta r,how-do-you-do . We necessitate some posh birds and chaps to user trial prods for champneys . Can i put you consume ? I need your address and dob asap . Ta r,speak uncle john today strongly feel need sacrifice go beg listen not promise clear thing easy need let work thing long expect help creativity stifle pls happy promise
0.8851743475648646,"Did you hear about the new \Divorce Barbie\""? It comes with all of Ken's stuff!""","act you hear about the worn \Divorce Barbie\ "" ? It comes with whole of sight 's stuff ! """,yeah sure thing mate haunt get stuff sort m go sound promote hex .by way not know number joke
0.8604374940348106,GSOH? Good with SPAM the ladies?U could b a male gigolo? 2 join the uk's fastest growing mens club reply ONCALL. mjzgroup. 08714342399.2stop reply STOP. msg@aPS1.50rcvd,GSOH ? Good with junk_e-mail the ladies?U could b a male gigolo ? 2 join the Britain 's fastest growing mens club response ONCALL . mjzgroup . 08714342399.2stop answer cease . msg@aPS1.50rcvd,sing hu think important find female know place preferably citizen smart help navigate thing like choose phone plan require guidance doubt ask especially girl
0.802567390553791,"Shop till u Drop, IS IT YOU, either 10K, 5K, aPS500 Cash or aPS100 Travel voucher, Call now, 09064011000. NTT PO Box CR01327BT fixedline Cost 150ppm mobile vary","Shop till u Drop , live IT YOU , either 10 K , quintet K , aPS500 hard_cash or aPS100 jaunt voucher , shout_out straightaway , 09064011000 . NTT PO boxwood CR01327BT fixedline monetary_value 150ppm roving vary",uncle boye need movie oh guide plus know torrent particularly legal system slow gr8 day plus start cos not meet online honey moon
0.7762028468792189,New TEXTBUDDY Chat 2 horny guys in ur area 4 just 25p Free 2 receive Search postcode or at gaytextbuddy.com. TXT ONE name to 89693. 08715500022 rpl Stop 2 cnl,newfangled TEXTBUDDY schmoose 2 horny guy_wire In Ur area tetrad unfair 25p obstruct two encounter Search postcode operating_theater at gaytextbuddy.com . TXT ONE distinguish to 89693 . 08715500022 rpl lay_off II cnl,way transport problematic sat night way u want ask   n   join bday feel free need know definite nos booking fri
